"","code","name","level","parent_id","name_es"
1022,"46111","Retail trade in grocery stores","fivedigit",1021.0,"Comercio al por menor en tiendas de abarrotes, ultramarinos y misceláneas"
1023,"461110","Retail trade in grocery stores","sixdigit",1022.0,"Comercio al por menor en tiendas de abarrotes, ultramarinos y misceláneas"
1024,"46112","Retail trade of red meat, poultry, fish and seafood","fivedigit",1021.0,"Comercio al por menor de carnes"
1025,"461121","Retail trade of red meat","sixdigit",1024.0,"Comercio al por menor de carnes rojas"
1026,"461122","Retail trade of poultry","sixdigit",1024.0,"Comercio al por menor de carne de aves"
1027,"461123","Retail trade of fish and seafood","sixdigit",1024.0,"Comercio al por menor de pescados y mariscos"
1028,"46113","Retail trade of fresh fruits and vegetables","fivedigit",1021.0,"Comercio al por menor de frutas y verduras frescas"
1029,"461130","Retail trade of fresh fruits and vegetables","sixdigit",1028.0,"Comercio al por menor de frutas y verduras frescas"
1030,"46114","Retail trade of food seeds and grains, spices and dried chili","fivedigit",1021.0,"Comercio al por menor de semillas y granos alimenticios, especias y chiles secos"
1031,"461140","Retail trade of food seeds and grains, spices and dried chili","sixdigit",1030.0,"Comercio al por menor de semillas y granos alimenticios, especias y chiles secos"
1032,"46115","Retail trade of milk, other dairy products and sausages","fivedigit",1021.0,"Comercio al por menor de leche, otros productos lácteos y embutidos"
1033,"461150","Retail trade of milk, other dairy products and sausages","sixdigit",1032.0,"Comercio al por menor de leche, otros productos lácteos y embutidos"
1034,"46116","Retail trade of candies and confectionery raw materials","fivedigit",1021.0,"Comercio al por menor de dulces y materias primas para repostería"
1035,"461160","Retail trade of candies and confectionery raw materials","sixdigit",1034.0,"Comercio al por menor de dulces y materias primas para repostería"
1036,"46117","Retail trade of popsicles and ice cream","fivedigit",1021.0,"Comercio al por menor de paletas de hielo y helados"
1037,"461170","Retail trade of popsicles and ice cream","sixdigit",1036.0,"Comercio al por menor de paletas de hielo y helados"
1038,"46119","Retail trade of other food","fivedigit",1021.0,"Comercio al por menor de otros alimentos"
1039,"461190","Retail trade of other food","sixdigit",1038.0,"Comercio al por menor de otros alimentos"
1040,"4612","Retail trade of beverages, ice and tobacco","fourdigit",1020.0,"Comercio al por menor de bebidas, hielo y tabaco"
1041,"46121","Retail trade of beverages, ice and tobacco","fivedigit",1040.0,"Comercio al por menor de bebidas y hielo"
1042,"461211","Retail trade of wine and liquor","sixdigit",1041.0,"Comercio al por menor de vinos y licores"
1043,"461212","Retail trade of beer","sixdigit",1041.0,"Comercio al por menor de cerveza"
1044,"461213","Retail trade of nonalcoholic beverages and ice","sixdigit",1041.0,"Comercio al por menor de bebidas no alcohólicas y hielo"
1045,"46122","Retail trade of cigarettes, cigars and tobacco","fivedigit",1040.0,"Comercio al por menor de cigarros, puros y tabaco"
1046,"461220","Retail trade of cigarettes, cigars and tobacco","sixdigit",1045.0,"Comercio al por menor de cigarros, puros y tabaco"
1047,"462","Retail trade in self-service shops and department stores","threedigit",1019.0,"Comercio al por menor en tiendas de autoservicio y departamentales"
1048,"4621","Retail trade in self-service shops","fourdigit",1047.0,"Comercio al por menor en tiendas de autoservicio"
1049,"46211","Retail trade in self-service shops","fivedigit",1048.0,"Comercio al por menor en tiendas de autoservicio"
1050,"462111","Retail trade in supermarkets","sixdigit",1049.0,"Comercio al por menor en supermercados"
1051,"462112","Retail trade in minisupermarkets","sixdigit",1049.0,"Comercio al por menor en minisupers"
1052,"4622","Retail trade in department stores","fourdigit",1047.0,"Comercio al por menor en tiendas departamentales"
1053,"46221","Retail trade in department stores","fivedigit",1052.0,"Comercio al por menor en tiendas departamentales"
1054,"462210","Retail trade in department stores","sixdigit",1053.0,"Comercio al por menor en tiendas departamentales"
1055,"463","Retail trade of textile products, costume jewelry, clothing accessories and footwear","threedigit",1019.0,"Comercio al por menor de productos textiles, bisutería, accesorios de vestir y calzado"
1056,"4631","Retail trade of textile products, except apparel","fourdigit",1055.0,"Comercio al por menor de productos textiles, excepto ropa"
1057,"46311","Retail trade of textile products, except apparel","fivedigit",1056.0,"Comercio al por menor de productos textiles, excepto ropa"
1058,"463111","Retail trade of fabrics","sixdigit",1057.0,"Comercio al por menor de telas"
1059,"463112","Retail trade of linen","sixdigit",1057.0,"Comercio al por menor de blancos"
1060,"463113","Retail trade of notions","sixdigit",1057.0,"Comercio al por menor de artículos de mercería y bonetería"
1061,"4632","Retail trade of apparel, costume jewelry and clothing accessories","fourdigit",1055.0,"Comercio al por menor de ropa, bisutería y accesorios de vestir"
1062,"46321","Retail of apparel, costume jewelry and clothing accessories","fivedigit",1061.0,"Comercio al por menor de ropa, bisutería y accesorios de vestir"
1063,"463211","Retail trade of apparel, except infants clothing and lingerie","sixdigit",1062.0,"Comercio al por menor de ropa, excepto de bebé y lencería"
1064,"463212","Retail trade of infants clothing","sixdigit",1062.0,"Comercio al por menor de ropa de bebé"
1065,"463213","Retail trade of lingerie","sixdigit",1062.0,"Comercio al por menor de lencería"
1066,"463214","Retail trade of costumes, regional clothing and wedding dresses","sixdigit",1062.0,"Comercio al por menor de disfraces, vestimenta regional y vestidos de novia"
1067,"463215","Retail trade of costume jewelry and clothing accessories","sixdigit",1062.0,"Comercio al por menor de bisutería y accesorios de vestir"
1068,"463216","Retail trade of leather and fur clothing and of other goods of these materials","sixdigit",1062.0,"Comercio al por menor de ropa de cuero y piel y de otros artículos de estos materiales"
1069,"463217","Retail trade of disposable diapers","sixdigit",1062.0,"Comercio al por menor de pañales desechables"
1070,"463218","Retail trade of hats","sixdigit",1062.0,"Comercio al por menor de sombreros"
1071,"4633","Retail trade of footwear","fourdigit",1055.0,"Comercio al por menor de calzado"
1072,"46331","Retail trade of footwear","fivedigit",1071.0,"Comercio al por menor de calzado"
1073,"463310","Retail trade of footwear","sixdigit",1072.0,"Comercio al por menor de calzado"
1074,"464","Retail trade of health care items","threedigit",1019.0,"Comercio al por menor de artículos para el cuidado de la salud"
1075,"4641","Retail trade of health care items","fourdigit",1074.0,"Comercio al por menor de artículos para el cuidado de la salud"
1076,"46411","Retail trade of pharmaceutical and naturist products","fivedigit",1075.0,"Comercio al por menor de productos farmacéuticos y naturistas"
1077,"464111","Pharmacies without minisupermarkets","sixdigit",1076.0,"Farmacias sin minisúper"
1078,"464112","Pharmacies with minisupermarkets","sixdigit",1076.0,"Farmacias con minisúper"
1079,"464113","Retail trade of naturist products, homeopathic medicines and food supplements","sixdigit",1076.0,"Comercio al por menor de productos naturistas, medicamentos homeopáticos y de complementos alimenticios"
1080,"46412","Retail trade of eyeglasses and orthopedic products","fivedigit",1075.0,"Comercio al por menor de lentes y artículos ortopédicos"
1081,"464121","Retail trade of eyeglasses","sixdigit",1080.0,"Comercio al por menor de lentes"
1082,"464122","Retail trade of orthopedic products","sixdigit",1080.0,"Comercio al por menor de artículos ortopédicos"
1083,"465","Retail trade of stationery supplies, recreational and other personal goods","threedigit",1019.0,"Comercio al por menor de artículos de papelería, para el esparcimiento y otros artículos de uso personal"
1084,"4651","Retail trade of perfumery and jewelry products","fourdigit",1083.0,"Comercio al por menor de artículos de perfumería y joyería"
1085,"46511","Retail trade of perfumery and jewelry articles","fivedigit",1084.0,"Comercio al por menor de artículos de perfumería y joyería"
1086,"465111","Retail trade of perfumery products and cosmetics","sixdigit",1085.0,"Comercio al por menor de artículos de perfumería y cosméticos"
1087,"465112","Retail trade of jewelry products and watches","sixdigit",1085.0,"Comercio al por menor de artículos de joyería y relojes"
1088,"4652","Retail trade of recreational goods","fourdigit",1083.0,"Comercio al por menor de artículos para el esparcimiento"
1089,"46521","Retail trade of recreational goods","fivedigit",1088.0,"Comercio al por menor de artículos para el esparcimiento"
1090,"465211","Retail trade of records and cassettes","sixdigit",1089.0,"Comercio al por menor de discos y casetes"
1091,"465212","Retail trade of toys","sixdigit",1089.0,"Comercio al por menor de juguetes"
1092,"465213","Retail trade of bicycles","sixdigit",1089.0,"Comercio al por menor de bicicletas"
1093,"465214","Retail trade of photographic equipment and material","sixdigit",1089.0,"Comercio al por menor de equipo y material fotográfico"
1094,"465215","Retail trade of sporting goods","sixdigit",1089.0,"Comercio al por menor de artículos y aparatos deportivos"
1095,"465216","Retail trade of musical instruments","sixdigit",1089.0,"Comercio al por menor de instrumentos musicales"
1096,"4653","Retail trade of stationery supplies, books, magazines and newspapers","fourdigit",1083.0,"Comercio al por menor de artículos de papelería, libros, revistas y periódicos"
1097,"46531","Retail trade of stationery supplies, books, magazines and newspapers","fivedigit",1096.0,"Comercio al por menor de artículos de papelería, libros, revistas y periódicos"
1098,"465311","Retail trade of stationery supplies","sixdigit",1097.0,"Comercio al por menor de artículos de papelería"
1099,"465312","Retail trade of books","sixdigit",1097.0,"Comercio al por menor de libros"
1100,"465313","Retail trade of magazines and newspapers","sixdigit",1097.0,"Comercio al por menor de revistas y periódicos"
1101,"4659","Retail of pets, gifts, religious, disposable and other personal goods","fourdigit",1083.0,"Comercio al por menor de mascotas, regalos, artículos religiosos, desechables y otros artículos de uso personal"
1102,"46591","Retail trade of pets, gifts, religious and disposable products, and other personal goods","fivedigit",1101.0,"Comercio al por menor de mascotas, regalos, artículos religiosos, desechables y otros artículos de uso personal"
1103,"465911","Retail trade of pets","sixdigit",1102.0,"Comercio al por menor de mascotas"
1104,"465912","Retail trade of gifts","sixdigit",1102.0,"Comercio al por menor de regalos"
1105,"465913","Retail trade of religious products","sixdigit",1102.0,"Comercio al por menor de artículos religiosos"
1106,"465914","Retail trade of disposable products","sixdigit",1102.0,"Comercio al por menor de artículos desechables"
1107,"465919","Retail trade of other personal goods","sixdigit",1102.0,"Comercio al por menor de otros artículos de uso personal"
1108,"466","Retail trade of household goods, computers, interior decorative articles and used goods","threedigit",1019.0,"Comercio al por menor de enseres domésticos, computadoras, artículos para la decoración de interiores y artículos usados"
1109,"4661","Retail trade of household furniture and other household goods","fourdigit",1108.0,"Comercio al por menor de muebles para el hogar y otros enseres domésticos"
1110,"46611","Retail trade of household furniture and other household goods","fivedigit",1109.0,"Comercio al por menor de muebles para el hogar y otros enseres domésticos"
1111,"466111","Retail trade of household furniture","sixdigit",1110.0,"Comercio al por menor de muebles para el hogar"
1112,"466112","Retail trade of small and major household appliances","sixdigit",1110.0,"Comercio al por menor de electrodomésticos menores y aparatos de línea blanca"
1113,"466113","Retail trade of outdoor home furniture","sixdigit",1110.0,"Comercio al por menor de muebles para jardín"
1114,"466114","Retail trade of glassware, china and cookware","sixdigit",1110.0,"Comercio al por menor de cristalería, loza y utensilios de cocina"
1115,"4662","Retail trade of computer furniture, equipment and accessories; telephones and other communication devices","fourdigit",1108.0,"Comercio al por menor de mobiliario, equipo y accesorios de cómputo, teléfonos y otros aparatos de comunicación"
1116,"46621","Retail trade of computer furniture, equipment and accessories; telephones and other communication devices","fivedigit",1115.0,"Comercio al por menor de mobiliario, equipo y accesorios de cómputo, teléfonos y otros aparatos de comunicación"
1117,"466211","Retail trade of computer furniture, equipment and accessories","sixdigit",1116.0,"Comercio al por menor de mobiliario, equipo y accesorios de cómputo"
1118,"466212","Retail trade of telephones and other communication devices","sixdigit",1116.0,"Comercio al por menor de teléfonos y otros aparatos de comunicación"
1119,"4663","Retail trade of interior decorative articles","fourdigit",1108.0,"Comercio al por menor de artículos para la decoración de interiores"
1120,"46631","Retail trade of interior decorative articles","fivedigit",1119.0,"Comercio al por menor de artículos para la decoración de interiores"
1121,"466311","Retail trade of carpets, curtains, tapestries and} similar products","sixdigit",1120.0,"Comercio al por menor de alfombras, cortinas, tapices y similares"
1122,"466312","Retail trade of natural plants and flowers","sixdigit",1120.0,"Comercio al por menor de plantas y flores naturales"
1123,"466313","Retail trade of antiques and art goods","sixdigit",1120.0,"Comercio al por menor de antigüedades y obras de arte"
1124,"466314","Retail trade of ornamental lamps and chandeliers","sixdigit",1120.0,"Comercio al por menor de lámparas ornamentales y candiles"
1125,"466319","Retail trade of other interior decorative articles","sixdigit",1120.0,"Comercio al por menor de otros artículos para la decoración de interiores"
1126,"4664","Retail trade of used goods","fourdigit",1108.0,"Comercio al por menor de artículos usados"
1127,"46641","Retail trade of used goods","fivedigit",1126.0,"Comercio al por menor de artículos usados"
1128,"466410","Retail trade of used goods","sixdigit",1127.0,"Comercio al por menor de artículos usados"
1129,"467","Retail trade of hardware and glass","threedigit",1019.0,"Comercio al por menor de artículos de ferretería, tlapalería y vidrios"
1130,"4671","Retail trade of hardware and glass","fourdigit",1129.0,"Comercio al por menor de artículos de ferretería, tlapalería y vidrios"
1131,"46711","Retail trade of hardware and glass","fivedigit",1130.0,"Comercio al por menor de artículos de ferretería, tlapalería y vidrios"
1132,"467111","Retail trade of hardware","sixdigit",1131.0,"Comercio al por menor en ferreterías y tlapalerías"
1133,"467112","Retail trade of ceramic floors and coverings","sixdigit",1131.0,"Comercio al por menor de pisos y recubrimientos cerámicos"
1134,"467113","Retail trade of paint","sixdigit",1131.0,"Comercio al por menor de pintura"
1135,"467114","Retail trade of glass and mirrors","sixdigit",1131.0,"Comercio al por menor de vidrios y espejos"
1136,"467115","Retail trade of cleaning supplies","sixdigit",1131.0,"Comercio al por menor de artículos para la limpieza"
1137,"467116","Retail trade of construction materials in specialized self-service shops","sixdigit",1131.0,"Comercio al por menor de materiales para la construcción en tiendas de autoservicio especializadas"
1138,"467117","Retail trade of pool equipment and accessories, and other articles","sixdigit",1131.0,"Comercio al por menor de artículos para albercas y otros artículos"
1139,"468","Retail trade of motor vehicles, parts, fuels and lubricants","threedigit",1019.0,"Comercio al por menor de vehículos de motor, refacciones, combustibles y lubricantes"
1140,"4681","Retail trade of automobiles and pickup trucks","fourdigit",1139.0,"Comercio al por menor de automóviles y camionetas"
1141,"46811","Retail trade of automobiles and pickup trucks","fivedigit",1140.0,"Comercio al por menor de automóviles y camionetas"
1142,"468111","Retail trade of new automobiles and pickup trucks","sixdigit",1141.0,"Comercio al por menor de automóviles y camionetas nuevos"
1143,"468112","Retail trade of used automobiles and pickup trucks","sixdigit",1141.0,"Comercio al por menor de automóviles y camionetas usados"
1144,"4682","Retail trade of parts for automobiles, pickup trucks and trucks","fourdigit",1139.0,"Comercio al por menor de partes y refacciones para automóviles, camionetas y camiones"
1145,"46821","Retail trade of parts for automobiles, pickup trucks and trucks","fivedigit",1144.0,"Comercio al por menor de partes y refacciones para automóviles, camionetas y camiones"
1146,"468211","Retail trade of new parts for automobiles, pickup trucks and trucks","sixdigit",1145.0,"Comercio al por menor de partes y refacciones nuevas para automóviles, camionetas y camiones"
1147,"468212","Retail trade of used parts for automobiles, pickup trucks and trucks","sixdigit",1145.0,"Comercio al por menor de partes y refacciones usadas para automóviles, camionetas y camiones"
1148,"468213","Retail trade of tires and tubes for automobiles, pickup trucks and trucks","sixdigit",1145.0,"Comercio al por menor de llantas y cámaras para automóviles, camionetas y camiones"
1149,"4683","Retail trade of motorcycles, and other motor vehicles","fourdigit",1139.0,"Comercio al por menor de motocicletas y otros vehículos de motor"
1150,"46831","Retail trade of motorcycles, and other motor vehicles","fivedigit",1149.0,"Comercio al por menor de motocicletas y otros vehículos de motor"
1151,"468311","Retail trade of motorcycles","sixdigit",1150.0,"Comercio al por menor de motocicletas"
1152,"468319","Retail trade of other motor vehicles","sixdigit",1150.0,"Comercio al por menor de otros vehículos de motor"
1153,"4684","Retail trade of fuels, lubricating oils and greases","fourdigit",1139.0,"Comercio al por menor de combustibles, aceites y grasas lubricantes"
1154,"46841","Retail trade of fuels","fivedigit",1153.0,"Comercio al por menor de combustibles"
1155,"468411","Retail trade of gasoline and diesel","sixdigit",1154.0,"Comercio al por menor de gasolina y diesel"
1156,"468412","Retail trade of LP gas in cylinders and for stationary tanks","sixdigit",1154.0,"Comercio al por menor de gas L. P. en cilindros y para tanques estacionarios"
1157,"468413","Retail trade of LP gas in gas filling stations","sixdigit",1154.0,"Comercio al por menor de gas L. P. en estaciones de carburación"
1158,"468419","Retail trade of other fuels","sixdigit",1154.0,"Comercio al por menor de otros combustibles"
1159,"46842","Retail trade of lubricating oils and greases, additives and similar products for motor vehicles","fivedigit",1153.0,"Comercio al por menor de aceites y grasas lubricantes, aditivos y similares para vehículos de motor"
1160,"468420","Retail trade of lubricating oils and greases, additives and similar products for motor vehicles","sixdigit",1159.0,"Comercio al por menor de aceites y grasas lubricantes, aditivos y similares para vehículos de motor"
1161,"469","Retail trade exclusively through Internet, and printed catalogs, television and similar media","threedigit",1019.0,"Comercio al por menor exclusivamente a través de Internet, y catálogos impresos, televisión y similares"
1162,"4691","Retail trade exclusively through Internet, and printed catalogs, television and similar media","fourdigit",1161.0,"Comercio al por menor exclusivamente a través de Internet, y catálogos impresos, televisión y similares"
1163,"46911","Retail trade exclusively through Internet, and printed catalogs, television and similar media","fivedigit",1162.0,"Comercio al por menor exclusivamente a través de Internet, y catálogos impresos, televisión y similares"
1164,"469110","Retail trade exclusively through Internet, and printed catalogs, television and similar media","sixdigit",1163.0,"Comercio al por menor exclusivamente a través de Internet, y catálogos impresos, televisión y similares"
1165,"48-49 ","Transportation, postal services and warehousing ","sixdigit",1163.0,"Transportes, correos y almacenamiento"
1166,"481","Air transportation","threedigit",1019.0,"Transporte aéreo"
1167,"4811","Scheduled air transportation","fourdigit",1166.0,"Transporte aéreo regular"
1168,"48111","Scheduled air transportation","fivedigit",1167.0,"Transporte aéreo regular"
1169,"481111","Domestic airlines scheduled air transportation","sixdigit",1168.0,"Transporte aéreo regular en líneas aéreas nacionales"
1170,"481112","Foreign airlines scheduled air transportation","sixdigit",1168.0,"Transporte aéreo regular en líneas aéreas extranjeras"
1171,"4812","Nonscheduled air transportation","fourdigit",1166.0,"Transporte aéreo no regular"
1172,"48121","Nonscheduled air transportation","fivedigit",1171.0,"Transporte aéreo no regular"
1173,"481210","Nonscheduled air transportation","sixdigit",1172.0,"Transporte aéreo no regular"
1174,"482","Rail transportation","threedigit",1019.0,"Transporte por ferrocarril"
1175,"4821","Rail transportation","fourdigit",1174.0,"Transporte por ferrocarril"
1176,"48211","Rail transportation","fivedigit",1175.0,"Transporte por ferrocarril"
1177,"482110","Rail transportation","sixdigit",1176.0,"Transporte por ferrocarril"
1178,"483","Water transportation","threedigit",1019.0,"Transporte por agua"
1179,"4831","Maritime transportation","fourdigit",1178.0,"Transporte marítimo"
1180,"48311","Maritime transportation","fivedigit",1179.0,"Transporte marítimo"
1181,"483111","High sea transportation, except petroleum and natural gas","sixdigit",1180.0,"Transporte marítimo de altura, excepto de petróleo y gas natural"
1182,"483112","Coastal transportation, except petroleum and natural gas","sixdigit",1180.0,"Transporte marítimo de cabotaje, excepto de petróleo y gas natural"
1183,"483113","Petroleum and natural gas maritime transportation","sixdigit",1180.0,"Transporte marítimo de petróleo y gas natural"
1184,"4832","Inland water transportation","fourdigit",1178.0,"Transporte por aguas interiores"
1185,"48321","Inland water transportation","fivedigit",1184.0,"Transporte por aguas interiores"
1186,"483210","Inland water transportation","sixdigit",1185.0,"Transporte por aguas interiores"
1187,"484","Freight truck transportation","threedigit",1019.0,"Autotransporte de carga"
1188,"4841","General freight trucking","fourdigit",1187.0,"Autotransporte de carga general"
1189,"48411","General freight trucking, local","fivedigit",1188.0,"Autotransporte local de carga general"
1190,"484111","Agricultural products trucking, local, except refrigerated","sixdigit",1189.0,"Autotransporte local de productos agrícolas sin refrigeración"
1191,"484119","Other general freight trucking, local","sixdigit",1189.0,"Otro autotransporte local de carga general"
1192,"48412","General freight trucking, long-distance","fivedigit",1188.0,"Autotransporte foráneo de carga general"
1193,"484121","Agricultural products trucking, long-distance, except refrigerated","sixdigit",1192.0,"Autotransporte foráneo de productos agrícolas sin refrigeración"
1194,"484129","Other general freight trucking, long-distance","sixdigit",1192.0,"Otro autotransporte foráneo de carga general"
1195,"4842","Specialized freight trucking","fourdigit",1187.0,"Autotransporte de carga especializado"
1196,"48421","Moving services","fivedigit",1195.0,"Servicios de mudanzas"
1197,"484210","Moving services","sixdigit",1196.0,"Servicios de mudanzas"
1198,"48422","Specialized freight trucking, local, except moving services","fivedigit",1195.0,"Autotransporte local de carga especializado, excepto mudanzas"
1199,"484221","Construction materials trucking, local","sixdigit",1198.0,"Autotransporte local de materiales para la construcción"
1200,"484222","Hazardous material and waste trucking, local","sixdigit",1198.0,"Autotransporte local de materiales y residuos peligrosos"
1201,"484223","Refrigerated trucking, local","sixdigit",1198.0,"Autotransporte local con refrigeración"
1202,"484224","Wood trucking, local","sixdigit",1198.0,"Autotransporte local de madera"
1203,"484229","Other specialized freight trucking, local","sixdigit",1198.0,"Otro autotransporte local de carga especializado"
1204,"48423","Specialized freight trucking, long-distance, except moving services","fivedigit",1195.0,"Autotransporte foráneo de carga especializado, excepto mudanzas"
1205,"484231","Construction materials trucking, long-distance","sixdigit",1204.0,"Autotransporte foráneo de materiales para la construcción"
1206,"484232","Hazardous material and waste trucking, long-distance","sixdigit",1204.0,"Autotransporte foráneo de materiales y residuos peligrosos"
1207,"484233","Refrigerated trucking, long-distance","sixdigit",1204.0,"Autotransporte foráneo con refrigeración"
1208,"484234","Wood trucking, long-distance","sixdigit",1204.0,"Autotransporte foráneo de madera"
1209,"484239","Other specialized freight trucking, long-distance","sixdigit",1204.0,"Otro autotransporte foráneo de carga especializado"
1210,"485","Passenger transportation by road, except by rail","threedigit",1019.0,"Transporte terrestre de pasajeros, excepto por ferrocarril"
