code	level	name_en	name_es	name_short_es	name_short_en
020742	6digit	Turkey cuts and offal (frozen)			Turkey meat, frozen
020743	6digit	Duck, goose, guinea fowl cuts & offal (frozen)			Duck meat, frozen
020750	6digit	Poultry livers, domestic, frozen			Poultry livers, domestic, frozen
020810	6digit	Rabbit or hare meat and offal			Rabbit meat and offal
020820	6digit	Frog legs			Frog legs
020890	6digit	Meat and offal, nes			Meat and offal, nes
020900	6digit	Pig and poultry fat, unrendered			Pig and poultry fat
021011	6digit	Salted/dried/smoked swine ham and shoulders			Cured pork shoulders and ham
021012	6digit	Salted/dried/smoked swine bellies			Cured swine bellies
021019	6digit	Salted/dried/smoked other swine meat			Cured pork
021020	6digit	Salted/dried/smoked beef			Cured beef
021090	6digit	Meat and offal cured, flours, meals, nes			Cured meat and offal
030110	6digit	Live ornamental fish			Live ornamental fish
030191	6digit	Live trout			Live trout
030192	6digit	Live eels			Live eels
030193	6digit	Live carp			Live carp
030199	6digit	Live fish except trout, eel, carp			Other live fish
030211	6digit	Whole trout			Trout
030212	6digit	Whole salmon			Salmon
030219	6digit	Whole salmonids, not trout or salmon			Salmonids, nes
030221	6digit	Whole halibut			Halibut
030222	6digit	Whole pollock			Pollock
030223	6digit	Whole sole			Sole
030229	6digit	Whole flatfish, except halibut/plaice/sole			Flatfish
030231	6digit	Whole albacore			Albacore
030232	6digit	Whole yellowfin tuna			Yellowfin tuna
030233	6digit	Whole skipjack, stripe-belly bonito			Bonito
030239	6digit	Whole tuna, nes			Tuna, nes
030240	6digit	Whole herring			Herring
030250	6digit	Whole cod			Cod
030261	6digit	Whole sardines, brisling, sprats			Sardines
030262	6digit	Whole haddock			Haddock
030263	6digit	Whole coalfish			Coalfish
030264	6digit	Whole mackerel			Mackerel
030265	6digit	Whole dogfish and other sharks			Shark
030266	6digit	Whole eels			Eels
030269	6digit	Whole fish, nes			Whole fish, nes
030270	6digit	Fish roes and livers			Fish roes and livers
030310	6digit	Whole Pacific salmon (frozen)			Pacific salmon, frozen
030321	6digit	Whole trout (frozen)			Trout, frozen
030322	6digit	Whole Atlantic or Danube salmon (frozen)			Atlantic salmon, frozen
030329	6digit	Whole salmonids, nes (frozen)			Salmonids, frozen, nes
030331	6digit	Whole halibut (frozen)			Halibut, frozen
030332	6digit	Whole plaice (frozen)			Plaice, frozen
030333	6digit	Whole sole (frozen)			Sole, frozen
030339	6digit	Whole flatfish, except plaice or sole (frozen)			Flatfish, frozen
030341	6digit	Whole albacore, longfin tuna (frozen)			Albacore, frozen
030342	6digit	Whole yellowfin tuna (frozen)			Yellowfin tuna, frozen
030343	6digit	Whole skipjack, bonito (frozen)			Bonito, frozen
030349	6digit	Whole tuna, nes (frozen)			Tuna, frozen, nes
030350	6digit	Whole herring (frozen)			Herring, frozen
030360	6digit	Whole cod (frozen)			Cod, frozen
030371	6digit	Whole sardines, brisling, sprats (frozen)			Sardines, frozen
030372	6digit	Whole haddock (frozen)			Haddock, frozen
030373	6digit	Whole pollock (frozen)			Pollock, frozen
030374	6digit	Whole mackerel (frozen)			Mackerel, frozen
030375	6digit	Whole dogfish and other sharks (frozen)			Sharks, frozen
030376	6digit	Whole eels (frozen)			Eels, frozen
030377	6digit	Whole sea bass (frozen)			Sea bass, frozen
030378	6digit	Whole hake (frozen)			Hake, frozen
030379	6digit	Whole fish, nes (frozen)			Whole fish, frozen, nes
030380	6digit	Fish roes and livers (frozen)			Fish roes & livers, frozen
030410	6digit	Fish fillet or meat, not liver or roe			Fish meat, not liver or roe
030420	6digit	Fish fillets (frozen)			Fish fillets, frozen
030490	6digit	Fish meat, except liver, roe, and fillets (frozen)			Other fish meat, frozen
030510	6digit	Flours, meals and pellets of fish			Fish flours, meals, and pellets
030520	6digit	Dried/smoked/salted livers and roes			Dried/smoked/salted livers and roes
030530	6digit	Dried or salted fish fillets			Dried/salted fish fillets
030541	6digit	Smoked salmon, including fillets			Smoked salmon
030542	6digit	Smoked herrings, including fillets			Smoked herrings
030549	6digit	Smoked fish & fillets, except herrings, salmon			Other smoked fish
030551	6digit	Dried cod			Dried cod
030559	6digit	Dried fish, except cod			Dried fish, not cod
030561	6digit	Salted herrings			Salted herrings
030562	6digit	Salted cod			Salted cod
030563	6digit	Salted anchovies			Salted anchovies
030569	6digit	Salted fish, nes			Salted fish, nes
030611	6digit	Rock lobster and other crawfish (frozen)			Crawfish, frozen
030612	6digit	Lobsters (frozen)			Lobsters, frozen
030613	6digit	Shrimps and prawns (frozen)			Shrimps, frozen
030614	6digit	Crabs (frozen)			Crabs, frozen
030619	6digit	Crustaceans, nes (frozen)			Crustaceans, frozen, nes
030621	6digit	Rock lobster and other crawfish			Crawfish
030622	6digit	Lobsters			Lobsters
030623	6digit	Shrimps and prawns			Shrimps
030624	6digit	Crabs			Crabs
030629	6digit	Crustaceans, nes			Crustaceans, nes
030710	6digit	Oysters			Oysters
030721	6digit	Scallops, live, fresh or chilled			Live scallops
030729	6digit	Scallops other than live, fresh or chilled			Scallops, not live
030731	6digit	Mussels, shelled or not, live, fresh or chilled			Mussels
030739	6digit	Mussels, frozen, dried, salted or in brine			Mussels (frozen/salted/dried)
030741	6digit	Cuttle fish, squid, live, fresh or chilled			Squid
030749	6digit	Cuttle fish, squid, frozen, dried, salted or in brine			Squid (frozen/salted/dried)
030751	6digit	Octopus, live, fresh or chilled			Octopus
030759	6digit	Octopus, frozen, dried, salted or in brine			Octopus (frozen/salted/dried)
030760	6digit	Snails, edible (except sea snails)			Snails
030791	6digit	Aquatic invertebrates nes, fresh or chilled, live			Aquatic invertebrates, nes
030799	6digit	Aquatic invertebrates nes, frozen or preserved			Aquatic invertebrates, nes (frozen/preserved)
040110	6digit	Milk not concentrated, sweetened < 1% fat			Milk, <1% fat
040120	6digit	Milk not concentrated, sweetened 1-6% fat			Milk, 1-6% fat
040130	6digit	Milk and cream not concentrated, sweetened > 6% fat			Milk and cream, >6% fat
040210	6digit	Milk powder < 1.5% fat			Milk powder, <1.5% fat
040221	6digit	Milk and cream powder unsweetened > 1.5% fat			Unsweetened milk powder, >1.5% fat
040229	6digit	Milk and cream powder sweetened > 1.5% fat			Sweetened milk powder, >1.5% fat
040291	6digit	Milk and cream unsweetened, concentrated			Concentrated unsweetened milk
040299	6digit	Milk and cream, nes sweetened, concentrated			Other milk and cream
040310	6digit	Yogurt			Yogurt
040390	6digit	Buttermilk, curdled milk, cream, etc.			Buttermilk, cream
040410	6digit	Whey			Whey
040490	6digit	Natural milk products			Natural milk products
040500	6digit	Butter, other milk fats and oils			Butter, milk fats & oils
040610	6digit	Fresh cheese, unfermented whey cheese, curd			Fresh cheese, curd
040620	6digit	Cheese, grated or powdered			Cheese, grated or powdered
040630	6digit	Cheese processed, not grated or powdered			Cheese processed
040640	6digit	Cheese, blue-veined			Cheese, blue-veined
040690	6digit	Cheese, not fresh, grated, processed or blue-veined			Cheese not fresh or processed
040700	6digit	Birds eggs, in shell, fresh, preserved or cooked			Eggs, in shell
040811	6digit	Egg yolks dried			Egg yolks, dried
040819	6digit	Egg yolks except dried			Egg yolks, not dried
040891	6digit	Eggs, bird, dried, not in shell			Eggs, dried
040899	6digit	Eggs, bird, not in shell not dried			Eggs, not in shell not dried
040900	6digit	Honey, natural			Honey
041000	6digit	Edible products of animal origin nes			Other edible animal products
050100	6digit	Hair, human, unworked			Human hair
050210	6digit	Bristles, hair & waste of pigs, hogs or boars			Bristles, hair & waste of pigs
050290	6digit	Hair & waste of badger & other brush-making hair			Hair & waste of badger
050300	6digit	Horsehair, waste			Horsehair, waste
050400	6digit	Guts, bladders & stomachs of animals not fish			Animal guts and stomachs
050510	6digit	Feathers & down used for stuffing			Feathers for stuffing
050590	6digit	Feathers, down, etc. of birds, except for stuffing			Feathers, not for stuffing
050610	6digit	Ossein & bones treated with acid			Ossein & bones treated with acid
050690	6digit	Bones & horn-cores, simply or not worked nes			Bones, simply or unworked nes
050710	6digit	Ivory, unworked or simply prepared, powder and waste			Ivory
050790	6digit	Whalebone, horns, etc unworked or simply prepared nes			Whalebone & horns
050800	6digit	Coral,seashell,cuttle bone,etc, unworked,powder,waste			Seashells, coral, etc.
050900	6digit	Sponges, natural, of animal origin			Natural sponges
051000	6digit	Ambergris, civet, musk, etc for pharmaceutical use			Ambergris, civet, pharmaceutic use
051110	6digit	Semen bovine			Bovine semen
051191	6digit	Fish, shellfish and crustaceans (non-food)			Non-food fish and crustaceans
051199	6digit	Animal products and domestic animal carcass (non-food			Non-food animal products
060110	6digit	Bulbs, tubers, corms, crowns and rhizomes, dormant			Bulbs and others, dormant
060120	6digit	Bulbs, tubers, corms etc in growth, chicory plants			Bulbs and others, in growth
060210	6digit	Cuttings and slips, not rooted			Plant cuttings
060220	6digit	Trees, edible fruit or nut, shrubs and bushes			Fruit or nut trees, shrubs
060230	6digit	Rhododendrons and azaleas			Rhododendrons and azaleas
060240	6digit	Roses			Roses
060291	6digit	Mushroom spawn			Mushroom spawn
060299	6digit	Plants, live (including their roots),nes			Live plants, nes
060310	6digit	Cut flowers and flower buds for bouquets, etc., fresh			Flowers for bouquets (fresh)
060390	6digit	Cut flowers and flower buds for bouquets, dried, etc.			Flowers for bouquets (dried)
060410	6digit	Mosses and lichens for bouquets, ornamental purposes			Ornamental mosses
060491	6digit	Foliage,branches, for bouquets, etc. - fresh			Foliage for bouquets (fresh)
060499	6digit	Foliage,branches, for bouquets, etc. - except fresh			Foliage for bouquets (not fresh)
070110	6digit	Potatoes seed, fresh or chilled			Potato seeds
070190	6digit	Potatoes, fresh or chilled except seed			Potatoes
070200	6digit	Tomatoes, fresh or chilled			Tomatoes
070310	6digit	Onions and shallots, fresh or chilled			Onions and shallots
070320	6digit	Garlic, fresh or chilled			Garlic
070390	6digit	Leeks & other alliaceous vegetables, fresh or chilled			Leeks
070410	6digit	Cauliflowers and headed broccoli, fresh or chilled			Cauliflowers and broccoli
070420	6digit	Brussels sprouts, fresh or chilled			Brussle sprouts
070490	6digit	Edible brassicas nes, fresh or chilled			Cabbages, nes
070511	6digit	Cabbage lettuce (head lettuce) fresh or chilled			Cabbage lettuce
070519	6digit	Lettuce, fresh or chilled except cabbage lettuce			Lettuce
070521	6digit	Witloof chicory, fresh or chilled			Witloof chicory
070529	6digit	Chicory, fresh or chilled, except witloof			Chicory
070610	6digit	Carrots and turnips, fresh or chilled			Carrots and turnips
070690	6digit	Beetroot,salsify,celeriac,radishes etc. fresh, chille			Beetroot, radishes, etc.
070700	6digit	Cucumbers and gherkins, fresh or chilled			Cucumbers
070810	6digit	Peas, shelled or unshelled, fresh or chilled			Peas
070820	6digit	Beans, shelled or unshelled, fresh or chilled			Beans
070890	6digit	Legumes except peas & beans, fresh or chilled			Other legumes
070910	6digit	Globe artichokes, fresh or chilled			Artichokes
070920	6digit	Asparagus, fresh or chilled			Asparagus
070930	6digit	Aubergines(egg-plants), fresh or chilled			Eggplants
070940	6digit	Celery, other than celeriac, fresh or chilled			Celery
070951	6digit	Mushrooms, fresh or chilled			Mushrooms
070952	6digit	Truffles, fresh or chilled			Truffles
070960	6digit	Peppers (Capsicum, Pimenta) fresh or chilled			Peppers
070970	6digit	Spinach fresh or chilled			Spinach
070990	6digit	Vegetables, fresh or chilled nes			Vegetables, nes
071010	6digit	Potatoes, frozen, uncooked steamed or boiled			Potatoes (frozen)
071021	6digit	Peas, frozen, uncooked steamed or boiled			Peas (frozen)
071022	6digit	Beans, frozen, uncooked steamed or boiled			Beans (frozen)
071029	6digit	Legumes, except peas and beans, frozen			Other legumes (frozen)
071030	6digit	Spinach, frozen, uncooked steamed or boiled			Spinach (frozen)
071040	6digit	Sweet corn, frozen, uncooked steamed or boiled			Sweet corn (frozen)
071080	6digit	Vegetables, frozen nes, uncooked steamed or boiled			Vegetables, nes (frozen)
071090	6digit	Frozen vegetable mixtures, uncooked, boiled or steame			Vegetable mixtures (frozen)
071110	6digit	Onions, provisionally preserved			Preserved Onions
071120	6digit	Olives, provisionally preserved			Preserved olives
071130	6digit	Capers, provisionally preserved			Preserved capers
071140	6digit	Cucumbers and gherkins provisionally preserved			Preserved cucumbers
071190	6digit	Vegetables nes and mixtures provisionally preserved			Preserved vegetables, nes
071210	6digit	Potatoes, dried, not further prepared			Potatoes (dried)
071220	6digit	Onions, dried, not further prepared			Onions (dried)
071230	6digit	Mushrooms and truffles, dried, not further prepared			Mushrooms and truffles (dried)
071290	6digit	Vegetables nes & mixtures, dried, not further prepare			Vegetables, nes (dried)
071310	6digit	Peas dried, shelled			Peas (dried)
071320	6digit	Chickpeas, dried, shelled			Chickpeas (dried)
071331	6digit	Urd,mung,black or green gram beans dried shelled			Black or green gram beans (dried)
071332	6digit	Beans, small red (Adzuki) dried, shelled			Adzuki beans (dried)
071333	6digit	Kidney beans and white pea beans dried shelled			Kidney beans (dried)
071339	6digit	Beans dried, shelled, nes			Beans, nes (dried)
071340	6digit	Lentils dried, shelled			Lentils (dried)
071350	6digit	Broad beans and horse beans dried, shelled			Broad beans (dried)
071390	6digit	Leguminous vegetables dried, shelled			Leguminous vegetables (dried)
071410	6digit	Manioc (cassava), fresh or dried			Manioc (cassava)
071420	6digit	Sweet potatoes, fresh or dried			Sweet potatoes
071490	6digit	Arrowroot, salep, etc fresh or dried and sago pith			Arrowroot, salep
080110	6digit	Coconuts, fresh or dried			Coconuts
080120	6digit	Brazil nuts, fresh or dried			Brazil nuts
080130	6digit	Cashew nuts, fresh or dried			Cashew nuts
080211	6digit	Almonds in shell fresh or dried			Almonds, in shell
080212	6digit	Almonds,fresh or dried, shelled			Almonds, shelled
080221	6digit	Hazelnuts and filberts in shell fresh or dried			Hazelnuts & filberts, in shell
080222	6digit	Hazelnuts and filberts, fresh or dried, shelled			Hazelnuts & filberts, shelled
080231	6digit	Walnuts in shell, fresh or dried			Walnuts, in shell
080232	6digit	Walnuts, fresh or dried, shelled			Walnuts, shelled
080240	6digit	Chestnuts, fresh or dried			Chestnuts
080250	6digit	Pistachios, fresh or dried			Pistachios
080290	6digit	Nuts edible, fresh or dried, nes			Nuts, edible, nes
080300	6digit	Bananas, including plantains, fresh or dried			Bananas & plantains
080410	6digit	Dates, fresh or dried			Dates
080420	6digit	Figs, fresh or dried			Figs
080430	6digit	Pineapples, fresh or dried			Pineapples
080440	6digit	Avocados, fresh or dried			Avocados
080450	6digit	Guavas, mangoes and mangosteens, fresh or dried			Guavas & mangoes
080510	6digit	Oranges, fresh or dried			Oranges
080520	6digit	Mandarin, clementine & citrus hybrids, fresh or dried			Mandarin & clementine
080530	6digit	Lemons and limes, fresh or dried			Lemons & limes
080540	6digit	Grapefruit, fresh or dried			Grapefruit
080590	6digit	Citrus fruits, fresh or dried, nes			Citrus fruits, nes
080610	6digit	Grapes, fresh			Grapes, fresh
080620	6digit	Grapes, dried			Grapes, dried
080710	6digit	Melons (including watermelons), fresh			Melons
080720	6digit	Papaws (papayas), fresh			Papaws (papayas)
080810	6digit	Apples, fresh			Apples
080820	6digit	Pears and quinces, fresh			Pears
080910	6digit	Apricots, fresh			Apricots, fresh
080920	6digit	Cherries, fresh			Cherries, fresh
080930	6digit	Peaches, nectarines, fresh			Peaches, nectarines
080940	6digit	Plums, sloes, fresh			Plums
081010	6digit	Strawberries, fresh			Strawberries, fresh
081020	6digit	Raspberry, blackberry, mulberry and loganberry, fresh			Raspberry, blackberry, fresh
081030	6digit	Black, white or red currants and gooseberries, fresh			Currants and gooseberries
081040	6digit	Cranberries, bilberries, similar fruits, fresh			Cranberries
081090	6digit	Fruits, fresh nes			Fruits, fresh nes
081110	6digit	Strawberries, (uncooked steamed or boiled), frozen			Strawberries, frozen
081120	6digit	Rasp-, mul-berries, etc (uncooked, steam, boil), frozen			Frozen rasp-, mul-berries, etc
081190	6digit	Fruits and nuts (uncooked, steamed, boiled) frozen,ne			Frozen fruits and nuts
081210	6digit	Cherries provisionally preserved			Cherries, preserved
081220	6digit	Strawberries provisionally preserved			Strawberries provisionally preserved
081290	6digit	Fruits and nuts, provisionally preserved nes			Preserved fruits and nuts
081310	6digit	Apricots, dried			Apricots, dried
081320	6digit	Prunes, dried			Prunes, dried
081330	6digit	Apples, dried			Apples, dried
081340	6digit	Fruits, dried nes			Fruits, dried nes
081350	6digit	Mixtures of edible nuts, dried and preserved fruits			Mixtures of edible nuts & fruits
081400	6digit	Peel of citrus, fruit, or melons			Peel of citrus, fruit
090111	6digit	Coffee, not roasted, not decaffeinated			Coffee, not roasted
090112	6digit	Coffee, not roasted, decaffeinated			Decaffeinated coffee, not roasted,
090121	6digit	Coffee, roasted, not decaffeinated			Coffee, roasted
090122	6digit	Coffee, roasted, decaffeinated			Decaffeinated coffee, roasted,
090130	6digit	Coffee husks and skins			Coffee husks and skins
090140	6digit	Coffee substitutes containing coffee			Coffee substitutes
090210	6digit	Tea, green (unfermented) in packages < 3 kg			Tea, green, in packages <3kg
090220	6digit	Tea, green (unfermented) in packages > 3 kg			Tea, green, in packages >3kg
090230	6digit	Tea, black (fermented or partly) in packages < 3 kg			Tea, black, in <3kg packages
090240	6digit	Tea, black (fermented or partly) in packages > 3 kg			Tea, black, in >3kg packages
090300	6digit	Mate			Mate
090411	6digit	Pepper of the genus Piper, whole			Pepper, whole
090412	6digit	Pepper of the genus Piper, crushed or ground			Pepper, crushed or ground
090420	6digit	Capsicum or Pimenta, dried, crushed or ground			Capsicum or Pimenta
090500	6digit	Vanilla beans			Vanilla beans
090610	6digit	Cinnamon and cinnamon-tree flowers whole			Cinnamon, whole
090620	6digit	Cinnamon and cinnamon-tree flowers crushed or ground			Cinnamon, crushed or ground
090700	6digit	Cloves (whole fruit, cloves and stems)			Cloves
090810	6digit	Nutmeg			Nutmeg
090820	6digit	Mace			Mace
090830	6digit	Cardamoms			Cardamoms
090910	6digit	Anise or badian seeds			Anise or badian seeds
090920	6digit	Coriander seeds			Coriander seeds
090930	6digit	Cumin seeds			Cumin seeds
090940	6digit	Caraway seeds			Caraway seeds
090950	6digit	Fennel seeds, juniper berries			Fennel seeds, juniper berries
091010	6digit	Ginger			Ginger
091020	6digit	Saffron			Saffron
091030	6digit	Turmeric (curcuma)			Turmeric
091040	6digit	Thyme and bay leaves			Thyme, bay leaves
091050	6digit	Curry			Curry
091091	6digit	Mixtures of spices			Mixtures of spices
091099	6digit	Spices nes			Spices nes
100110	6digit	Durum wheat			Durum wheat
100190	6digit	Wheat except durum wheat, and meslin			Wheat & meslin
100200	6digit	Rye			Rye
100300	6digit	Barley			Barley
100400	6digit	Oats			Oats
100510	6digit	Maize (corn) seed			Maize (corn) seed
100590	6digit	Maize except seed corn			Maize except seed corn
100610	6digit	Rice in the husk (paddy or rough)			Rice, in the husk
100620	6digit	Rice, husked (brown)			Rice, husked (brown)
100630	6digit	Rice, semi-milled or wholly milled			Rice, semi- or wholly-milled
100640	6digit	Rice, broken			Rice, broken
100700	6digit	Grain sorghum			Grain sorghum
100810	6digit	Buckwheat			Buckwheat
100820	6digit	Millet			Millet
100830	6digit	Canary seed			Canary seed
100890	6digit	Cereals unmilled nes			Cereals, unmilled nes
110100	6digit	Wheat or meslin flour			Wheat or meslin flour
110210	6digit	Rye flour			Rye flour
110220	6digit	Maize (corn) flour			Maize (corn) flour
110230	6digit	Rice flour			Rice flour
110290	6digit	Cereal flour except wheat, meslin, rye, maize, rice			Cereal flour, nes
110311	6digit	Wheat meal			Wheat meal
110312	6digit	Oat groats or meal			Oat groats or meal
110313	6digit	Maize (corn) groats or meal			Maize (corn) meal
110314	6digit	Rice groats or meal			Rice groats or meal
110319	6digit	Cereal groats or meal except wheat, maize, rice, oats			Cereal meal, nes
110321	6digit	Wheat pellets			Wheat pellets
110329	6digit	Cereal pellets except wheat			Cereal pellets
110411	6digit	Barley, rolled or flaked grains			Barley, rolled or flaked grains
110412	6digit	Oats, rolled or flaked grains			Oats, rolled or flaked grains
110419	6digit	Cereals, rolled or flaked grains nes			Cereals, rolled/flaked grains, nes
110421	6digit	Barley, hulled, pearled, sliced or kibbled			Barley, hulled, pearled
110422	6digit	Oats, hulled, pearled, sliced or kibbled			Oats, hulled, pearled
110423	6digit	Maize (corn), hulled, pearled, sliced or kibbled			Maize (corn), hulled, pearled,
110429	6digit	Cereals, hulled, pearled, sliced or kibbled nes			Cereals, hulled, pearled
110430	6digit	Germ of cereals, whole, rolled, flaked or ground			Germ of cereals
110510	6digit	Potato flour or meal			Potato flour or meal
110520	6digit	Potato flakes, granules and pellets			Potato flakes, granules and pellets
110610	6digit	Flour or meal of dried legumes			Flour, meal of dried legumes
110620	6digit	Flour or meal of sago, starchy roots or tubers			Flour, meal of starchy roots
110630	6digit	Flour, meal, powder of fruit/nut, citrus or melon pee			Flour, meal, powder of fruit/nut
110710	6digit	Malt, not roasted			Malt, not roasted
110720	6digit	Malt, roasted			Malt, roasted
110811	6digit	Wheat, starch			Wheat starch
110812	6digit	Maize (corn) starch			Maize (corn) starch
110813	6digit	Potato starch			Potato starch
110814	6digit	Manioc (cassava) starch			Manioc (cassava) starch
110819	6digit	Starches except wheat, maize, potato, manioc			Other starches, nes
110820	6digit	Inulin			Inulin
110900	6digit	Wheat gluten			Wheat gluten
120100	6digit	Soya beans			Soya beans
120210	6digit	Ground-nuts in shell not roasted or cooked			Ground-nuts, in shell
120220	6digit	Ground-nuts shelled, not roasted or cooked			Ground-nuts, shelled
120300	6digit	Copra			Copra
120400	6digit	Linseed			Linseed
120500	6digit	Rape or colza seeds			Rape or colza seeds
120600	6digit	Sunflower seeds			Sunflower seeds
120710	6digit	Palm nuts and kernels			Palm nuts & kernels
120720	6digit	Cotton seeds			Cotton seeds
120730	6digit	Castor oil seeds			Castor oil seeds
120740	6digit	Sesamum seeds			Sesamum seeds
120750	6digit	Mustard seeds			Mustard seeds
120760	6digit	Safflower seeds			Safflower seeds
120791	6digit	Poppy seeds			Poppy seeds
120792	6digit	Shea nuts (karite nuts)			Shea nuts (karite nuts)
120799	6digit	Oil seeds and oleaginous fruits, nes			Oil seeds & oleaginous fruits, nes
120810	6digit	Soya bean flour or meal			Soya bean flour or meal
120890	6digit	Flour or meal of oil seed, fruit, except mustard, soy			Oil seed or fruit flour or meal
120911	6digit	Seed, sugar beet, for sowing			Seed, sugar beet
120919	6digit	Seed, beet, except sugar, for sowing			Seed, beet, except sugar, for sowing
120921	6digit	Seed, lucerne (alfalfa), for sowing			Seed, lucerne (alfalfa)
120922	6digit	Seed, clover, for sowing			Seed, clover
120923	6digit	Seed, fescue, for sowing			Seed, fescue
120924	6digit	Seed, Kentucky blue grass, for sowing			Seed, Kentucky blue grass
120925	6digit	Seed, rye grass, for sowing			Seed, rye grass, for sowing
120926	6digit	Seed, Timothy grass, for sowing			Seed, Timothy grass
120929	6digit	Seed, forage plants, for sowing nes			Seed, forage plants, nes
120930	6digit	Seed, flower, for sowing			Seed, flower
120991	6digit	Seed, vegetable, nes for sowing			Seed, vegetable, nes
120999	6digit	Seed, fruits and spores for sowing, nes			Seed, fruits and spores, nes
121010	6digit	Hop cones, not ground, powdered or pelleted			Hop cones, not ground
121020	6digit	Hop cones, ground, powdered or pelleted and lupulin			Hop cones, ground, & lupulin
121110	6digit	Liquorice roots			Liquorice roots
121120	6digit	Ginseng roots			Ginseng roots
121190	6digit	Plants & parts, pharmacy, perfume, insecticide use ne			Plants, for pharmacy, insecticide
121210	6digit	Locust beans, locust seeds			Locust beans & seeds
121220	6digit	Seaweeds and other algae,			Seaweeds & algae
121230	6digit	Apricot, peach and plum stones & kernels, human food			Stone fruit stones & kernels
121291	6digit	Sugar beet			Sugar beet
121292	6digit	Sugar cane			Sugar cane
121299	6digit	Vegetable products nes for human consumption			Vegetable products, edible
121300	6digit	Cereal straw & husks, unprepared			Cereal straw & husks
121410	6digit	Lucerne (alfalfa) meal and pellets			Lucerne (alfalfa) meal and pellets
121490	6digit	Other fodder and forage products, roots, etc.			Forage products, roots
130110	6digit	Lac			Lac
130120	6digit	Gum arabic			Gum arabic
130190	6digit	Natural gum, resin, gum-resin, balsam, not gum arabic			Natural gum, resin
130211	6digit	Opium sap			Opium sap
130212	6digit	Liquorice extract			Liquorice extract
130213	6digit	Hop extract			Hop extract
130214	6digit	Pyrethrum, roots containing rotenone, extracts			Pyrethrum, rotenone roots
130219	6digit	Vegetable saps and extracts nes			Vegetable saps & extracts
130220	6digit	Pectic substances, pectinates, pectates			Pectic substances
130231	6digit	Agar-agar			Agar-agar
130232	6digit	Mucilages & thickeners, from locust bean, guar seeds			Mucilages of locust bean, guar seeds
130239	6digit	Mucilages and thickeners nes			Mucilages & thickeners nes
140110	6digit	Bamboos used primarily for plaiting			Bamboos for plaiting
