code	level	name_en	name_es	name_short_es	name_short_en
6209	4digit	Babies' garments and clothing accessories	Prendas y complementos (accesorios), de vestir, para bebés.	Prendas de vestir para bebés	Babies' garments
6210	4digit	Garments, made up of fabrics of heading 5602, 5603, 5903, 5906 or 5907	Prendas de vestir confeccionadas con productos de las partidas nos 56.02, 56.03, 59.03, 59.06 ó 59.07.	Prendas de vestir de fieltro o tela sin tejer	Garments made of textile felts and nonwoven fabric
6211	4digit	Track suits, ski-suits and swimwear; other garments	"Conjuntos de abrigo para entrenamiento o deporte (chandales), monos (overoles) y conjuntos de esquí y ""trajes de baño"" (bañadores); las demás prendas de vestir."	Ropa deportiva	Activewear
6212	4digit	Brassieres, girdles, corsets, braces, suspenders, garters and similar articles and parts thereof, whether or not knitted or crocheted	Sostenes (corpiños), fajas, corsés, tirantes (tiradores), ligas y artículos similares, y sus partes, incluso de punto.	Sostenes y artículos similares	Brassieres
6213	4digit	Handkerchiefs	Pañuelos de bolsillo.	Pañuelos de bolsillo	Handkerchiefs
6214	4digit	Shawls, scarves, mufflers,mantillas, veils and the like	Chales, pañuelos de cuello, bufandas, mantillas, velos y artículos similares.	Chales, pañuelos de cuello, etc	Shawls, scarves, etc.
6215	4digit	Ties, bow ties and cravats	Corbatas y lazos similares.	Corbatas y lazos similares	Ties, bow ties and cravats
6216	4digit	Gloves, mittens and mitts:	Guantes, mitones y manoplas.	Guantes	Gloves
6217	4digit	Other made up clothing accessories; parts of garments or of clothing accessories, other than thoseof heading 6212	Los demás complementos (accesorios) de vestir confeccionados; partes de prendas o de complementos (accesorios), de vestir, excepto las de la partida 62.12.	Los demás complementos de vestir	Other clothing accesories
6301	4digit	Blankets and traveling rugs	Mantas.	Mantas	Blankets
6302	4digit	Bed linen, table linen, toilet linen and kitchen linen	Ropa de cama, mesa, tocador o cocina.	Ropa de cama	House linen
6303	4digit	Curtains (including drapes) and interior blinds; curtain or bed valances	Visillos y cortinas; guardamalletas y rodapiés de cama.	Visillos y cortinas	Curtains
6304	4digit	Other furnishing articles, excluding those of heading 9404	Los demás artículos de tapicería, excepto los de la partida 94.04.	Los demás artículos de tapicería	Other furnishing articles
6305	4digit	Sacks and bags, of a kind used for the packing of goods	Sacos (bolsas) y talegas, para envasar.	Sacos para envasar	Bags for packing goods
6306	4digit	Tarpaulins, awnings and sunblinds; tents; sails for boats, sailboards or landcraft; camping goods	Toldos de cualquier clase; tiendas (carpas); velas para embarcaciones, deslizadores o vehículos terrestres; artículos de acampar.	Toldos, velámenes y artículos de acampar	Tents, tarpaulins, etc.
6307	4digit	Other made up articles, including dress patterns	Los demás artículos confeccionados, incluidos los patrones para prendas de vestir.	Los demás artículos confeccionados	Other made up articles
6308	4digit	Needlecraft sets of woven fabric & yarn, retail pack	Juegos constituidos por piezas de tejido e hilados, incluso con accesorios, para la confección de alfombras, tapicería, manteles o servilletas bordados o de artículos textiles similares, en envases para la venta al por menor.	Juegos de tejido e hilados	Needlecraft sets of woven fabric and yarn
6309	4digit	Used clothes and textiles	Artículos de prendería.	Artículos de prendería	Used clothes and textiles
6310	4digit	Used or new rags, scrap twine, cordage, rope and cables, and worn out articles of twine, cordage, rope or cables, of textile materials	Trapos; cordeles, cuerdas y cordajes, de materia textil, en desperdicios o en artículos inservibles.	Trapos y cordajes textiles en desperdicios	Used or new rags textile scraps
6401	4digit	Waterproof footwear with outer soles and uppers of rubber or plastics, the uppers of which are neither fixed to the sole nor assembled by stitching, riveting, nailing, screwing, plugging or similar processes	Calzado impermeable con suela y parte superior de caucho o plástico, cuya parte superior no se haya unido a la suela por costura o por medio de remaches, clavos, tornillos, espigas o dispositivos similares, ni se haya formado con diferentes partes unidas de la misma manera.	Calzado impermeable	Waterproof footwear
6402	4digit	Other footwear with outer soles and uppers of rubber or plastics	Los demás calzados con suela y parte superior de caucho o plástico.	Los demás calzados de caucho o plástico	Other footwear of rubber or plastics
6403	4digit	Footwear with outer soles of rubber, plastics, leather or composition leather and uppers of leather	Calzado con suela de caucho, plástico, cuero natural o regenerado y parte superior de cuero natural.	Calzado de cuero	Leather footwear
6404	4digit	Footwear with outer soles of rubber, plastics, leather or composition leather and uppers of textile materials	Calzado con suela de caucho, plástico, cuero natural o regenerado y parte superior de materia textil.	Calzado de materia textil	Textile footwear
6405	4digit	Other footwear	Los demás calzados.	Los demás calzados	Other footwear
6406	4digit	Parts of footwear (including uppers whether or not attached to soles other than outer soles); removable insoles, heel cushions and similar articles; gaiters, leggings and similar articles, and parts thereof	Partes de calzado (incluidas las partes superiores fijadas a las palmillas distintas de la suela); plantillas, taloneras y artículos similares, amovibles; polainas y artículos similares, y sus partes.	Partes de calzado	Parts of footwear
6501	4digit	Hat forms, hat bodies and hoods of felt, neither blocked to shape nor with made brims; plateaux and manchons (including slit manchons), of felt:	Cascos sin ahormado ni perfilado del ala, platos (discos) y cilindros, aunque estén cortados en el sentido de la altura, de fieltro, para sombreros.	Gorras, de múltiples formas	Hat forms
6502	4digit	Hat shapes, plaited or made by assembling strips of any material, neither blocked to shape, nor with made brims, not lined, nor trimmed:	Cascos para sombreros, trenzados o fabricados por unión de tiras de cualquier materia, sin ahormado ni perfilado del ala y sin guarnecer.	Cascos para sombreros	Hat shapes
6503	4digit	Felt hats & other felt headgear	Sombreros y demas tocados de fieltro fabricados con cascos o platos dela partida 65.01, incluso guarnecidos.	Sombreros y demás tocados de fieltro	Felt hats
6504	4digit	Hats and other headgear, plaited or made by assembling strips of any material, whether or not lined or trimmed:	Sombreros y demás tocados, trenzados o fabricados por unión de tiras de cualquier materia, incluso guarnecidos.	Sombreros	Hats
6505	4digit	Hats and other headgear, knitted or crocheted, or made up from lace, felt or other textile fabric, in the piece (but not in strips), whether or not lined or trimmed; hair-nets of any material, whether or not lined or trimmed	Sombreros y demás tocados, de punto o confeccionados con encaje, fieltro u otro producto textil, en pieza (pero no en tiras), incluso guarnecidos; redecillas para el cabello, de cualquier materia, incluso guarnecidas.	Gorras, de punto	Hats, knit
6506	4digit	Other headgear, whether or not lined or trimmed	Los demás sombreros y tocados, incluso guarnecidos.	Los demás sombreros y tocados	Other headgear
6507	4digit	Headbands, linings, covers, hat foundations, hat frames, peaks (visors) and chin straps, for headgear	Desudadores, forros, fundas, armaduras, viseras y barboquejos (barbijos), para sombreros y demás tocados.	Desudadores	Headbands
6601	4digit	Umbrellas and sun umbrellas (including walking-stick umbrellas, garden umbrellas and similar umbrellas)	Paraguas, sombrillas y quitasoles (incluidos los paraguas bastón, los quitasoles toldo y artículos similares).	Paraguas	Umbrellas
6602	4digit	Walking-sticks, seat-sticks, whips, riding-crops and the like	Bastones, bastones asiento, látigos, fustas y artículos similares.	Bastones	Walking sticks
6603	4digit	Parts, trimmings and accessories of articles of heading 6601 or 6602	Partes, guarniciones y accesorios para los artículos de las partidas 66.01 ó 66.02.	Piezas de paraguas o bastones	Parts of umbrellas or walking sticks
6701	4digit	Skins and other parts of birds with their feathers or down, feathers, parts of feathers, down and articles thereof (other than goods of heading 0505 and worked quills and scapes):	Pieles y demás partes de ave con sus plumas o plumón; plumas, partes de plumas, plumón y artículos de estas materias, excepto los productos de la partida 05.05 y los cañones y astiles de plumas, trabajados.	Plumas o plumón	Feathers or down
6702	4digit	Artificial flowers, foliage and fruit and parts thereof; articles made of artificial flowers, foliage or fruit	Flores, follaje y frutos, artificiales, y sus partes; artículos confeccionados con flores, follaje o frutos, artificiales.	Flores artificiales	Artificial flowers
6703	4digit	Human hair, dressed, thinned, bleached or otherwise worked; wool or other animal hair or other textile materials, prepared for use in making wigs or the like:	Cabello peinado, afinado, blanqueado o preparado de otra forma; lana, pelo u otra materia textil, preparados para la fabricación de pelucas o artículos similares.	Cabello o lana para pelucas	Human animal hair prepared for use in wigs
6704	4digit	Wigs, false beards, eyebrows and eyelashes, switches and the like, of human or animal hair or of textile materials; articles of human hair not elsewhere specified or included	Pelucas, barbas, cejas, pestañas, mechones y artículos análogos, de cabello, pelo o materia textil; manufacturas de cabello no expresadas ni comprendidas en otra parte.	Pelucas	Wigs
6801	4digit	Setts, curbstones and flagstones, of natural stone (except slate)	Adoquines, encintados (bordillos) y losas para pavimentos, de piedra natural (excepto la pizarra).	Losas para pavimentos, de piedra natural	Flagstones, of natural stone
6802	4digit	Worked monumental or building stone (except slate) and articles thereof, other than goods of heading 6801; mosaic cubes and the like, of natural stone (including slate), whether or not on a backing; artificially colored granules, chippings and powder, of	Piedras de talla o de construcción trabajadas (excluida la pizarra) y sus manufacturas, excepto las de la partida 68.01; cubos, dados y artículos similares para mosaicos, de piedra natural (incluida la pizarra), aunque estén sobre soporte; gránulos, tasquiles (fragmentos) y polvo de piedra natural (incluida la pizarra), coloreados artificialmente.	Piedras de construcción trabajadas	Worked building stone
6803	4digit	Worked slate and articles of slate or of agglomerated slate:	Pizarra natural trabajada y manufacturas de pizarra natural o aglomerada.	Pizarra natural trabajada	Worked slate
6804	4digit	Millstones, grindstones, grinding wheels and the like, without frameworks, for grinding, sharpening, polishing, trueing or cutting, hand sharpening or polishing stones, and parts thereof, of natural stone, of agglomerated natural or artificial abrasives,	Muelas y artículos similares, sin bastidor, para moler, desfibrar, triturar, afilar, pulir, rectificar, cortar o trocear, piedras de afilar o pulir a mano, y sus partes, de piedra natural, de abrasivos naturales o artificiales aglomerados o de cerámica, incluso con partes de otras materias.	Muelas y artículos similares para moler	Grindstones
6805	4digit	Natural or artificial abrasive powder or grain, on a base of textile material, of paper, of paperboard or of other materials, whether or not cut to shape or sewn or otherwise made up	Abrasivos naturales o artificiales en polvo o gránulos con soporte de materia textil, papel, cartón u otras materias, incluso recortados, cosidos o unidos de otra forma.	Abrasivos naturales o artificiales en polvo	Natural or artificial abrasive powder
6806	4digit	Slag wool, rock wool and similar mineral wools; exfoliated vermiculite, expanded clays, foamed slag and similar expanded mineral materials; mixtures and articles of heat-insulating, sound-insulating or sound-absorbing mineral materials, other than those o	Lana de escoria, de roca y lanas minerales similares; vermiculita dilatada, arcilla dilatada, espuma de escoria y productos minerales similares dilatados; mezclas y manufacturas de materias minerales para aislamiento térmico o acústico o para la absorción del sonido, excepto las de las partidas 68.11, 68.12 ó del Capítulo 69.	Lanas de escoria, roca y otras minerales	Mineral wools and insulating materials
6807	4digit	Articles of asphalt or of similar material (for example, petroleum bitumen or coal tar pitch)	Manufacturas de asfalto o de productos similares (por ejemplo: pez de petróleo, brea).	Asfalto	Asphalt
6808	4digit	Panels, boards, tiles, blocks and similar articles of vegetable fiber, of straw or of shavings, chips, particles, sawdust or other waste, of wood, agglomerated with cement, plaster or other mineral binders	Paneles, placas, losetas, bloques y artículos similares, de fibra vegetal, paja o viruta, de plaquitas o partículas, o de aserrín o demás desperdicios de madera, aglomerados con cemento, yeso fraguable o demás aglutinantes minerales.	Paneles de fibre vegetal	Panels of vegetable fibers
6809	4digit	Articles of plaster or of compositions based on plaster	Manufacturas de yeso fraguable o de preparaciones a base de yeso fraguable.	Artículos de yeso	Plaster articles
6810	4digit	Articles of cement, of concrete or of artificial stone, whether or not reinforced	Manufacturas de cemento, hormigón o piedra artificial, incluso armadas.	Manufacturas de cemento, hormigón o piedra artificial	Articles of cement, of concrete or of artificial stone
6811	4digit	Articles of asbestos-cement, of cellulose fiber-cement or the like	Manufacturas de amiantocemento, celulosacemento o similares.	Manufacturas de amiantocemento y celulosacemento	Asbestos-cement or cellulose fiber-cement
6812	4digit	Fabricated asbestos fibers; mixtures with a basis of asbestos or with a basis of asbestos and magnesium carbonate; articles of such mixtures or of asbestos (for example, thread, woven fabric, clothing, headgear, footwear, gaskets), whether or not reinforc	Amianto (asbesto) en fibras trabajado; mezclas a base de amianto o a base de amianto y carbonato de magnesio; manufacturas de estas mezclas o de amianto (por ejemplo: hilados, tejidos, prendas de vestir, sombreros y demás tocados, calzado, juntas), incluso armadas, excepto las de las partidas 68.11 ó 68.13.	Amianto fibras	Asbestos fibres
6813	4digit	Friction material and articles thereof (for example, sheets, rolls, strips, segments, discs, washers, pads), not mounted, for brakes, for clutches or the like, with a basis of asbestos, of other mineral substances or of cellulose, whether or not combined	Guarniciones de fricción (por ejemplo: hojas, rollos, tiras, segmentos, discos, arandelas, plaquitas) sin montar, para frenos, embragues o cualquier órgano de frotamiento, a base de amianto (asbesto), de otras sustancias minerales o de celulosa, incluso combinados con textiles o demás materias.	Guarniciones de fricción	Friction material and articles thereof
6814	4digit	Worked mica and articles of mica, including agglomerated or reconstituted mica, whether or not on a support of paper, paperboard or other materials	Mica trabajada y manufacturas de mica, incluida la aglomerada o reconstituida, incluso con soporte de papel, cartón o demás materias.	Mica artículos	Mica articles
6815	4digit	Articles of stone or of other mineral substances (including carbon fibers, articles of carbon fibers and articles of peat), not elsewhere specified or included	Manufacturas de piedra o demás materias minerales (incluidas las fibras de carbono y sus manufacturas y las manufacturas de turba), no expresadas ni comprendidas en otra parte.	Manufacturas de piedra y otros minerales	Articles of stone or of other mineral substances
6901	4digit	Bricks, blocks, tiles and other ceramic goods of siliceous fossil meals (for example, kieselguhr, tripolite or diatomite) or of similar siliceous earths	"Ladrillos, placas, baldosas y demás piezas cerámicas de harinas silíceas fósiles (por ejemplo: ""Kieselguhr"", tripolita, diatomita) o de tierras silíceas análogas."	Ladrillos, placas y demás piezas cerámicas	Bricks, blocks, and other ceramic goods
6902	4digit	Refractory bricks, blocks, tiles and similar refractory ceramic constructional goods, other than those of siliceous fossil meals or similar siliceous earths	Ladrillos, placas, baldosas y piezas cerámicas análogas de construcción, refractarios, excepto los de harinas silíceas fósiles o de tierras silíceas análogas.	Ladrillos, placas y piezas cerámicas de construcción	Bricks, tiles and similar refractory ceramic constructional goods
6903	4digit	Other refractory ceramic goods (for example, retorts, crucibles, muffles, nozzles, plugs, supports, cupels, tubes, pipes, sheaths and rods), other than those of siliceous fossil meals or of similar siliceous earths	Los demás artículos cerámicos refractarios (por ejemplo: retortas, crisoles, muflas, toberas, tapones, soportes, copelas, tubos, fundas, varillas), excepto los de harinas silíceas fósiles o de tierras silíceas análogas.	Los demás artículos cerámicos refractarios	Other refractory ceramic goods
6904	4digit	Ceramic building bricks, flooring blocks, support or filler tiles and the like	Ladrillos de construcción, bovedillas, cubrevigas y artículos similares, de cerámica.	Ladrillos de construcción de cerámica	Ceramic building bricks
6905	4digit	Roofing tiles, chimney pots, cowls, chimney liners, architectural ornaments and other ceramic constructional goods	Tejas, elementos de chimenea, conductos de humo, ornamentos arquitectónicos y demás artículos cerámicos de construcción.	Ornamentos arquitectónicos	Architectural ceramic ornaments
6906	4digit	Ceramic pipes, conduits, guttering and pipe fittings	Tubos, canalones y accesorios de tubería, de cerámica.	Tubos de cerámica	Ceramic pipes
6907	4digit	Unglazed ceramic flags and paving, hearth or wall tiles; unglazed ceramic mosaic cubes and the like, whether or not on a backing	Placas y baldosas, de cerámica, sin barnizar ni esmaltar, para pavimentación o revestimiento; cubos, dados y artículos similares, de cerámica, para mosaicos, sin barnizar ni esmaltar, incluso con soporte.	Placas y baldosas, de cerámica, sin barnizar	Unglazed ceramic flags and pavers
6908	4digit	Glazed ceramic flags and paving, hearth or wall tiles; glazed ceramic mosaic cubes and the like, whether or not on a backing	Placas y baldosas, de cerámica, barnizadas o esmaltadas, para pavimentación o revestimiento; cubos, dados y artículos similares, de cerámica, para mosaicos, barnizados o esmaltados, incluso con soporte.	Placas y baldosas, de cerámica, barnizadas	Glazed ceramic flags and pavers
6909	4digit	Ceramic wares for laboratory, chemical or other technical uses; ceramic troughs, tubs and similar receptacles of a kind used in agriculture; ceramic pots, jars and similar articles of a kind used for the conveyance or packing of goods	Aparatos y artículos, de cerámica, para usos químicos o demás usos técnicos; abrevaderos, pilas y recipientes similares, de cerámica, para uso rural; cántaros y recipientes similares, de cerámica, para transporte o envasado.	Artículos de cerámica para usos químicos, rurales, o envasados	Ceramic wares for technical ware
6910	4digit	Ceramic sinks, washbasins, washbasin pedestals, baths, bidets, water closet bowls, flush tanks, urinals and similar sanitary fixtures	Fregaderos (piletas de lavar), lavabos, pedestales de lavabo, bañeras, bidés, inodoros, cisternas (depósitos de agua) para inodoros, urinarios y aparatos fijos similares, de cerámica, para usos sanitarios.	Fregaderos y lavabos de cerámica, para usos sanitarios	Ceramic sinks, washbasins, and similar sanitary fixtures
6911	4digit	Tableware, kitchenware, other household articles and toilet articles, of porcelain or china	Vajilla y demás artículos de uso doméstico, higiene o tocador, de porcelana.	Artículos de uso doméstico de porcelana	Porcelain or china household articles
6912	4digit	Ceramic tableware, kitchenware, other household articles and toilet articles, other than of porcelain or china:	Vajilla y demás artículos de uso doméstico, higiene o tocador, de cerámica, excepto porcelana.	Artículos de uso doméstico de ceramica	Ceramic household articles
6913	4digit	Statuettes and other ornamental ceramic articles	Estatuillas y demás artículos para adorno, de cerámica.	Artículos para adorno, de cerámica	Ornamental ceramic articles
6914	4digit	Other ceramic articles	Las demás manufacturas de cerámica.	Las demás manufacturas de cerámica	Other ceramic articles
7001	4digit	Cullet and other waste and scrap of glass; glass in the mass:	Desperdicios y desechos de vidrio; vidrio en masa.	Desperdicios y desechos de vidrio	Cullet and other scraps of glass
7002	4digit	Glass in balls (other than microspheres of heading 7018), rods or tubes, unworked	Vidrio en bolas (excepto las microesferas de la partida 70.18), barras, varillas o tubos, sin trabajar.	Vidrio en bolas	Glass balls
7003	4digit	Cast glass and rolled glass, in sheets or profiles, whether or not having an absorbent, reflecting or non-reflecting layer, but not otherwise worked	Vidrio colado o laminado, en placas, hojas o perfiles, incluso con capa absorbente, reflectante o antirreflectante, pero sin trabajar de otro modo.	Vidrio colado o laminado	Glass, cast or rolled
7004	4digit	Drawn glass and blown glass, in sheets, whether or not having an absorbent, reflecting or non-reflecting layer, but not otherwise worked	Vidrio estirado o soplado, en hojas, incluso con capa absorbente, reflectante o antirreflectante, pero sin trabajar de otro modo.	Vidrio estirado o soplado	Drawn and blown glass
7005	4digit	Float glass and surface ground or polished glass, in sheets, whether or not having an absorbent, reflecting or non-reflecting layer, but not otherwise worked	Vidrio flotado y vidrio desbastado o pulido por una o las dos caras, en placas u hojas, incluso con capa absorbente, reflectante o antirreflectante, pero sin trabajar de otro modo.	Vidrio flotado	Float glass
7006	4digit	Glass of heading 7003, 7004 or 7005, bent, edge-worked, engraved, drilled, enameled or otherwise worked, but not framed or fitted with other materials:	Vidrio de las partidas 70.03, 70.04 ó 70.05, curvado, biselado, grabado, taladrado, esmaltado o trabajado de otro modo, pero sin enmarcar ni combinar con otras materias.	Vidrio, trabajado	Worked glass
7007	4digit	Safety glass, consisting of toughened (tempered) or laminated glass	Vidrio de seguridad constituido por vidrio templado o contrachapado.	Vidrio de seguridad	Safety glass
7008	4digit	Multiple-walled insulating units of glass	Vidrieras aislantes de paredes múltiples.	Vidrieras aislantes de paredes múltiples	Multiple-walled insulating glass
7009	4digit	Glass mirrors, whether or not framed, including rear-view mirrors	Espejos de vidrio, enmarcados o no, incluidos los espejos retrovisores.	Espejos de vidrio	Glass mirrors
7010	4digit	Carboys, bottles, flasks, jars, pots, vials, ampoules and other containers, of glass, of a kind used for the conveyance or packing of goods; preserving jars of glass; stoppers, lids and other closures, of glass	Bombonas (damajuanas), botellas, frascos, bocales, tarros, envases tubulares, ampollas y demás recipientes para el transporte o envasado, de vidrio; bocales para conservas, de vidrio; tapones, tapas y demás dispositivos de cierre, de vidrio	Bombonas, botellas, y otros recipientes de vidrio	Glass containers for conveyance
7011	4digit	Glass envelopes (including bulbs and tubes), open, and glass parts thereof, without fittings, for electric lamps, cathode-ray tubes or the like	Ampollas y envolturas tubulares, abiertas, y sus partes, de vidrio, sin guarniciones, para lámparas eléctricas, tubos catódicos o similares.	Bombillas de vidrio	Glass envelopes
7012	4digit	Glass inners for vacuum flasks, other vacuum vessels	Ampollas de vidrio para termos y demas recipientes isotermicos aislados por vacio.	Ampollas de vidrio para termos y demas recipientes isotermicos aislados por vacio	Glass inners for vacuum flasks
7013	4digit	Glassware of a kind used for table, kitchen, toilet, office, indoor decoration or similar purposes (other than that of heading 7010 or 7018)	Artículos de vidrio para servicio de mesa, cocina, tocador, baño, oficina, adorno de interiores o usos similares (excepto los de las partidas 70.10 ó 70.18).	Artículos de vidrio para adorno de interiores	Glassware for interior decorative use
7014	4digit	Signaling glassware and optical elements of glass (other than those of heading 7015), not optically worked:	Vidrio para señalización y elementos de óptica de vidrio (excepto los de la partida 70.15), sin trabajar ópticamente.	Vidrio para señalización	Signaling glassware
7015	4digit	Clock or watch glasses and similar glasses, glasses for noncorrective or corrective spectacles, curved, bent, hollowed or the like, not optically worked; hollow glass spheres and their segments, for the manufacture of such glasses	Cristales para relojes y cristales análogos, cristales para gafas (anteojos), incluso correctores, abombados, curvados, ahuecados o similares, sin trabajar ópticamente; esferas huecas y sus segmentos (casquetes esféricos), de vidrio, para la fabricación de estos cristales.	Cristales para relojes y cristales análogos	Clock or watch glasses and similar glasses
