code	level	name_en	name_es	name_short_es	name_short_en
600230	6digit	Knit or crochet fabric, width > 30 cm, >5% elastomer			Knit, >30cm, >5% elastic
600241	6digit	Warp knit fabric of wool or fine animal hair, nes			Warp knit, wool/hair, nes
600242	6digit	Warp knit fabric of cotton, nes			Warp knit, cotton, nes
600243	6digit	Warp knit fabric of manmade fibres, nes			Warp knit, manmade, nes
600249	6digit	Warp knit fabric of other materials, nes			Warp knit, other materials, nes
600291	6digit	Knit, crochet fabric of wool or fine animal hair, nes			Knit, wool/hair, nes
600292	6digit	Knit or crochet fabric of cotton, nes			Knit, cotton, nes
600293	6digit	Knit or crochet fabric of manmade fibres, nes			Knit, manmade, nes
600299	6digit	Knit or crochet fabric of other materials, nes			Knit, other materials, nes
610110	6digit	Mens, boys overcoats, etc, of wool or hair, knit			Mens overcoats, wool/hair, knit
610120	6digit	Mens, boys overcoats, etc, of cotton, knit			Mens overcoats, cotton, knit
610130	6digit	Mens, boys overcoats, etc, of manmade fibres, knit			Mens overcoats, manmade fibres, knit
610190	6digit	Mens, boys overcoats, etc, of material nes, knit			Mens overcoats, material nes, knit
610210	6digit	Womens, girls overcoats, etc, of wool or hair, knit			Womens overcoats, wool/hair, knit
610220	6digit	Womens, girls overcoats, etc, of cotton, knit			Womens overcoats, cotton, knit
610230	6digit	Womens, girls overcoats, etc, manmade fibres, knit			Womens overcoats, manmade fibres, knit
610290	6digit	Womens, girls overcoats, etc, material nes, knit			Womens overcoats, material nes, knit
610311	6digit	Mens, boys suits, of wool, fine animal hair, knit			Mens suits, of wool, fine animal hair, knit
610312	6digit	Mens, boys suits, synthetic fibres, knit			Mens suits, synthetic fibres, knit
610319	6digit	Mens, boys suits, of materials nes, knit			Mens suits, materials nes, knit
610321	6digit	Mens, boys ensembles, of wool animal hair, knit			Mens ensembles, wool animal hair, knit
610322	6digit	Mens, boys ensembles, of cotton, knit			Mens ensembles, cotton, knit
610323	6digit	Mens, boys ensembles, synthetic fibres, knit			Mens ensembles, synthetic fibres, knit
610329	6digit	Mens, boys ensembles, of material nes, knit			Mens ensembles, material nes, knit
610331	6digit	Mens, boys jackets & blazers, wool or hair, knit			Mens jackets & blazers, wool/hair, knit
610332	6digit	Mens, boys jackets & blazers, cotton, knit			Mens jackets & blazers, cotton, knit
610333	6digit	Mens, boys jackets & blazers, synthetic fibres, knit			Mens jackets & blazers, synthetic fibres, knit
610339	6digit	Mens, boys jackets & blazers, material nes, knit			Mens jackets & blazers, material nes, knit
610341	6digit	Mens, boys trousers & shorts, of wool or hair, knit			Mens trousers & shorts, wool/hair, knit
610342	6digit	Mens, boys trousers & shorts, of cotton, knit			Mens trousers & shorts, cotton, knit
610343	6digit	Mens, boys trousers, shorts, of synthetic fibres, kni			Mens trousers, shorts, synthetic fibres, knit
610349	6digit	Mens, boys trousers & shorts, of material nes, knit			Mens trousers & shorts, material nes, knit
610411	6digit	Womens, girls suits, of wool or hair, knit			Womens suits, wool/hair, knit
610412	6digit	Womens, girls suits, of cotton, knit			Womens suits, cotton, knit
610413	6digit	Womens, girls suits, synthetic fibres, knit			Womens suits, synthetic fibres, knit
610419	6digit	Womens, girls suits, of material nes, knit			Womens suits, material nes, knit
610421	6digit	Womens, girls ensembles, of wool or hair, knit			Womens ensembles, wool/hair, knit
610422	6digit	Womens, girls ensembles, of cotton, knit			Womens ensembles, cotton, knit
610423	6digit	Womens, girls ensembles, synthetic fibres, knit			Womens ensembles, synthetic fibres, knit
610429	6digit	Womens, girls ensembles, of material nes, knit			Womens ensembles, material nes, knit
610431	6digit	Womens, girls jackets & blazers, of wool or hair,knit			Womens jackets & blazers, wool/hair, knit
610432	6digit	Womens, girls jackets & blazers, of cotton, knit			Womens jackets & blazers, cotton, knit
610433	6digit	Womens, girls jackets, blazers, synthetic fibres, kni			Womens jackets & blazers, synthetic fibres, knit
610439	6digit	Womens, girls jackets & blazers, material nes, knit			Womens jackets & blazers, material nes, knit
610441	6digit	Womens, girls dresses, of wool or hair, knit			Womens dresses, wool/hair, knit
610442	6digit	Womens, girls dresses, of cotton, knit			Womens dresses, cotton, knit
610443	6digit	Womens, girls dresses, of synthetic fibres, knit			Womens dresses, synthetic fibres, knit
610444	6digit	Womens, girls dresses, of artificial fibres, knit			Womens dresses, artificial fibres, knit
610449	6digit	Womens, girls dresses, of material nes, knit			Womens dresses, material nes, knit
610451	6digit	Womens, girls skirts, of wool or hair, knit			Womens skirts, wool/hair, knit
610452	6digit	Womens, girls skirts, of cotton, knit			Womens skirts, cotton, knit
610453	6digit	Womens, girls skirts, synthetic fibres, knit			Womens skirts, synthetic fibres, knit
610459	6digit	Womens, girls skirts, of material nes, knit			Womens skirts, material nes, knit
610461	6digit	Womens, girls trousers & shorts, of wool hair, knit			Womens trousers & shorts, wool/hair, knit
610462	6digit	Womens, girls trousers & shorts, of cotton, knit			Womens trousers & shorts, of cotton, knit
610463	6digit	Womens, girls trousers, shorts, synthetic fibres, kni			Womens trousers & shorts, synthetic fibres, knit
610469	6digit	Womens, girls trousers & shorts, material nes, knit			Womens trousers & shorts, material nes, knit
610510	6digit	Mens, boys shirts, of cotton, knit			Mens shirts, cotton, knit
610520	6digit	Mens, boys shirts, of manmade fibres, knit			Mens shirts, manmade fibres, knit
610590	6digit	Mens, boys shirts, of materials nes, knit			Mens shirts, materials nes, knit
610610	6digit	Womens, girls blouses & shirts, of cotton, knit			Womens blouses & shirts, cotton, knit
610620	6digit	Womens, girls blouses & shirts, manmade fibre, knit			Womens blouses & shirts, manmade fibre, knit
610690	6digit	Womens, girls blouses & shirts, of material nes, knit			Womens blouses & shirts, material nes, knit
610711	6digit	Mens, boys underpants or briefs, of cotton, knit			Mens underpants or briefs, cotton, knit
610712	6digit	Mens, boys underpants or briefs, manmade fibre, knit			Mens underpants or briefs, manmade fibre, knit
610719	6digit	Mens, boys underpants or briefs, material nes, knit			Mens underpants or briefs, material nes, knit
610721	6digit	Mens, boys nightshirts or pyjamas, of cotton, knit			Mens pyjamas, cotton, knit
610722	6digit	Mens, boys nightshirts or pyjamas, manmade fibre, kni			Mens pyjamas, manmade fibre, knit
610729	6digit	Mens, boys nightshirts or pyjamas, material nes, knit			Mens pyjamas, material nes, knit
610791	6digit	Mens, boys bathrobes, dressing gowns etc cotton, knit			Mens bathrobes, cotton, knit
610792	6digit	Mens, boys bathrobes, dressing gown manmade fibre kni			Mens bathrobes, manmade fibre, knit
610799	6digit	Mens, boys bathrobes, dressing gown etc fibre nes kni			Mens bathrobes, fibre nes, knit
610811	6digit	Womens, girls slips or petticoats, manmade fibre knit			Womens slips or petticoats, manmade fibre, knit
610819	6digit	Womens, girls slips or petticoats, material nes knit			Womens slips or petticoats, material nes, knit
610821	6digit	Womens, girls briefs or panties, of cotton, knit			Womens briefs or panties, cotton, knit
610822	6digit	Womens, girls briefs or panties, manmade fibre, knit			Womens briefs or panties, manmade fibre, knit
610829	6digit	Womens, girls briefs or panties, material nes, knit			Womens briefs or panties, material nes, knit
610831	6digit	Womens, girls nightdress or pyjamas, of cotton, knit			Womens pyjamas, cotton, knit
610832	6digit	Womens, girls nightdress or pyjama manmade fibre, kni			Womens pyjamas, manmade fibre, knit
610839	6digit	Womens, girls nightdress, pyjamas, material nes, knit			Womens pyjamas, material nes, knit
610891	6digit	Womens, girls bathrobe, dressing gowns, of knit cotto			Womens bathrobe, dressing gowns, cotton, knit
610892	6digit	Women/girl bathrobe, dressing gown, knit manmade fibr			Womens bathrobe, manmade fibre, knit
610899	6digit	Womens, girls bathrobe, dressing gowns, nes, knit			Womens bathrobe, material nes, knit
610910	6digit	T-shirts, singlets and other vests, of cotton, knit			T-shirts, of cotton, knit
610990	6digit	T-shirts, singlets etc, of material nes, knit			T-shirts, of material nes, knit
611010	6digit	Pullovers, cardigans etc of wool or hair, knit			Pullovers, cardigans, of wool/hair, knit
611020	6digit	Pullovers, cardigans etc of cotton, knit			Pullovers, cardigans, of cotton, knit
611030	6digit	Pullovers, cardigans etc of manmade fibres, knit			Pullovers, cardigans, of manmade fibres, knit
611090	6digit	Pullovers, cardigans etc of material nes knit			Pullovers, cardigans, of material nes, knit
611110	6digit	Babies garments, accessories of wool or hair, knit			Babies garments, of wool/hair, knit
611120	6digit	Babies garments, accessories of cotton, knit			Babies garments, of cotton, knit
611130	6digit	Babies garments, accessories of synthetic fibres, kni			Babies garments, of synthetic fibres, knit
611190	6digit	Babies garments, accessories of material nes, knit			Babies garments, of material nes, knit
611211	6digit	Track suits, of cotton, knit			Track suits, cotton, knit
611212	6digit	Track suits, synthetic fibres, knit			Track suits, synthetic fibres, knit
611219	6digit	Track suits, of materials nes, knit			Track suits, materials nes, knit
611220	6digit	Ski suits, of textile materials, knit			Ski suits, of textile materials, knit
611231	6digit	Mens, boys swimwear, synthetic fibres, knit			Mens swimwear, synthetic fibres, knit
611239	6digit	Mens, boys swimwear, of material nes, knit			Mens swimwear, of material nes, knit
611241	6digit	Womens, girls swimwear, synthetic fibres, knit			Womens swimwear, synthetic fibres, knit
611249	6digit	Womens, girls swimwear, of material nes, knit			Womens swimwear, of material nes, knit
611300	6digit	Garments of knit or crochet impregnated fabric			Garments of knit/crochet impregnated fabric
611410	6digit	Garments nes, of wool or fine animal hair, knit			Garments nes, of wool/hair, knit
611420	6digit	Garments nes, of cotton, knit			Garments nes, of cotton, knit
611430	6digit	Garments nes, of manmade fibres, knit			Garments nes, of manmade fibres, knit
611490	6digit	Garments nes, of materials nes, knit			Garments nes, of materials nes, knit
611511	6digit	Panty hose etc, synthetic fibre yarn <67 dtex/sy, kni			Panty hose etc, synthetic fibre, <67 dtex/sy, knit
611512	6digit	Panty hose etc, synthetic fibre yarn >67 dtex/sy, kni			Panty hose etc, synthetic fibre, >67 dtex/sy, knit
611519	6digit	Panty hose etc of materials nes, knit			Panty hose etc, materials nes, knit
611520	6digit	Womens full, kneelength hosiery, yarn <67 dtex/sy,kni			Hosiery, full/kneelength, <67 dtex/sy, knit
611591	6digit	Hosiery nes, of wool or fine animal hair, knit			Hosiery nes, of wool/hair, knit
611592	6digit	Hosiery nes, of cotton, knit			Hosiery nes, of cotton, knit
611593	6digit	Hosiery nes, synthetic fibres, knit			Hosiery nes, synthetic fibres, knit
611599	6digit	Hosiery nes, of materials nes, knit			Hosiery nes, materials nes, knit
611610	6digit	Gloves impregnated or coated with plastic,rubber, kni			Gloves impregnated with plastic/rubber, knit
611691	6digit	Gloves, mittens or mitts, nes, of wool or hair, knit			Gloves, wool/hair, knit
611692	6digit	Gloves, mittens or mitts, nes, of cotton, knit			Gloves, cotton, knit
611693	6digit	Gloves, mittens or mitts, nes, synthetic fibres, knit			Gloves, synthetic fibres, knit
611699	6digit	Gloves, mittens or mitts, nes, material nes knit			Gloves, material nes, knit
611710	6digit	Shawls, scarves, veils etc, textile material, knit			Shawls, scarves, textile material, knit
611720	6digit	Ties, bow ties and cravats, of textile material, knit			Ties, of textile material, knit
611780	6digit	Clothing accessories nes, of textile material, knit			Clothing accessories nes, textile material, knit
611790	6digit	Parts of garments, accessories, textile material, kni			Parts of garments, textile material, knit
620111	6digit	Mens, boys overcoats of wool or hair, not knit			Mens overcoats, wool/hair, not knit
620112	6digit	Mens, boys overcoats of cotton, not knit			Mens overcoats, cotton, not knit
620113	6digit	Mens, boys overcoats of manmade fibres, not knit			Mens overcoats, manmade fibres, not knit
620119	6digit	Mens, boys overcoats of material nes, not knit			Mens overcoats, material nes, not knit
620191	6digit	Mens, boys anoraks etc, of wool or hair, not knit			Mens anoraks, wool/hair, not knit
620192	6digit	Mens, boys anoraks etc, of cotton, not knit			Mens anoraks, cotton, not knit
620193	6digit	Mens, boys anoraks etc, of manmade fibres, not knit			Mens anoraks, manmade fibres, not knit
620199	6digit	Mens, boys anoraks etc, of material nes, not knit			Mens anoraks, material nes, not knit
620211	6digit	Womens, girls overcoats etc of wool or hair not knit			Womens overcoats, wool/hair, not knit
620212	6digit	Womens, girls overcoats etc of cotton, not knit			Womens overcoats, cotton, not knit
620213	6digit	Womens, girls overcoats etc manmade fibre, not knit			Womens overcoats, manmade fibre, not knit
620219	6digit	Womens, girls overcoats of material nes, not knit			Womens overcoats, material nes, not knit
620291	6digit	Womens, girls anoraks etc of wool or hair, not knit			Womens anoraks, wool/hair, not knit
620292	6digit	Womens, girls anoraks etc of cotton, not knit			Womens anoraks, cotton, not knit
620293	6digit	Womens, girls anoraks etc of manmade fibres, not knit			Womens anoraks, manmade fibres, not knit
620299	6digit	Womens, girls anoraks etc of material nes, not knit			Womens anoraks, material nes, not knit
620311	6digit	Mens, boys suits, of wool or hair, not knit			Mens suits, wool/hair, not knit
620312	6digit	Mens, boys suits, synthetic fibres, not knit			Mens suits, synthetic fibres, not knit
620319	6digit	Mens, boys suits, of material nes, not knit			Mens suits, material nes, not knit
620321	6digit	Mens, boys ensembles, of wool or hair, not knit			Mens ensembles, wool/hair, not knit
620322	6digit	Mens, boys ensembles, of cotton, not knit			Mens ensembles, cotton, not knit
620323	6digit	Mens, boys ensembles, synthetic fibres, not knit			Mens ensembles, synthetic fibres, not knit
620329	6digit	Mens, boys ensembles, of material nes, not knit			Mens ensembles, material nes, not knit
620331	6digit	Mens, boys jackets & blazers, wool or hair, not knit			Mens jackets & blazers, wool/hair, not knit
620332	6digit	Mens, boys jackets & blazers, of cotton, not knit			Mens jackets & blazers, cotton, not knit
620333	6digit	Mens, boys jackets, blazers, synthetic fibre, not kni			Mens jackets & blazers, synthetic fibre, not knit
620339	6digit	Mens, boys jackets & blazers, material nes, not knit			Mens jackets & blazers, material nes, not knit
620341	6digit	Mens, boys trousers & shorts, wool or hair, not knit			Mens trousers & shorts, wool/hair, not knit
620342	6digit	Mens, boys trousers & shorts, of cotton, not knit			Mens trousers & shorts, cotton, not knit
620343	6digit	Mens, boys trousers shorts, synthetic fibre, not knit			Mens trousers & shorts, synthetic fibre, not knit
620349	6digit	Mens, boys trousers & shorts, material nes, not knit			Mens trousers & shorts, material nes, not knit
620411	6digit	Womens, girls suits, of wool or hair, not knit			Womens suits, wool/hair, not knit
620412	6digit	Womens, girls suits, of cotton, not knit			Womens suits, cotton, not knit
620413	6digit	Womens, girls suits, synthetic fibres, not knit			Womens suits, synthetic fibres, not knit
620419	6digit	Womens, girls suits, of material nes, not knit			Womens suits, material nes, not knit
620421	6digit	Womens, girls ensembles, of wool or hair, not knit			Womens ensembles, wool/hair, not knit
620422	6digit	Womens, girls ensembles, of cotton, not knit			Womens ensembles, cotton, not knit
620423	6digit	Womens, girls ensembles, synthetic fibres, not knit			Womens ensembles, synthetic fibres, not knit
620429	6digit	Womens, girls ensembles, material nes, not knit			Womens ensembles, material nes, not knit
620431	6digit	Womens, girls jackets, blazers, wool or hair, not kni			Womens jackets & blazers, wool/hair, not knit
620432	6digit	Womens, girls jackets & blazers, of cotton, not knit			Womens jackets & blazers, cotton, not knit
620433	6digit	Womens, girls jackets, blazers, synth fibres, not kni			Womens jackets & blazers, synth fibres, not knit
620439	6digit	Womens, girls jackets & blazers, material nes,not kni			Womens jackets & blazers, material nes, not knit
620441	6digit	Womens, girls dresses, of wool or hair, not knit			Womens dresses, wool/hair, not knit
620442	6digit	Womens, girls dresses, of cotton, not knit			Womens dresses, cotton, not knit
620443	6digit	Womens, girls dresses, synthetic fibres, not knit			Womens dresses, synthetic fibres, not knit
620444	6digit	Womens, girls dresses, of artificial fibres, not knit			Womens dresses, artificial fibres, not knit
620449	6digit	Womens, girls dresses, of material nes, not knit			Womens dresses, material nes, not knit
620451	6digit	Womens, girls skirts, of wool or hair, not knit			Womens skirts, wool/hair, not knit
620452	6digit	Womens, girls skirts, of cotton, not knit			Womens skirts, cotton, not knit
620453	6digit	Womens, girls skirts, synthetic fibres, not knit			Womens skirts, synthetic fibres, not knit
620459	6digit	Womens, girls skirts, of material nes, not knit			Womens skirts, material nes, not knit
620461	6digit	Womens, girls trousers, shorts, wool or hair, not kni			Womens trousers & shorts, wool/hair, not knit
620462	6digit	Womens, girls trousers & shorts, of cotton, not knit			Womens trousers & shorts, cotton, not knit
620463	6digit	Womens, girls trousers, shorts, synth fibres, not kni			Womens trousers & shorts, synth fibres, not knit
620469	6digit	Womens, girls trousers, shorts, material nes, not kni			Womens trousers & shorts, material nes, not knit
620510	6digit	Mens, boys shirts, of wool or hair, not knit			Mens shirts, wool/hair, not knit
620520	6digit	Mens, boys shirts, of cotton, not knit			Mens shirts, cotton, not knit
620530	6digit	Mens, boys shirts, of manmade fibres, not knit			Mens shirts, manmade fibres, not knit
620590	6digit	Mens, boys shirts, of material nes, not knit			Mens shirts, material nes, not knit
620610	6digit	Womens, girls blouses & shirts, of silk, not knit			Womens blouses & shirts, silk, not knit
620620	6digit	Womens, girls blouses & shirts, wool or hair, not kni			Womens blouses & shirts, wool/hair, not knit
620630	6digit	Womens, girls blouses & shirts, of cotton, not knit			Womens blouses & shirts, cotton, not knit
620640	6digit	Womens, girls blouses, shirts, manmade fibre, not kni			Womens blouses & shirts, manmade fibre, not knit
620690	6digit	Womens, girls blouses & shirts, material nes, not kni			Womens blouses & shirts, material nes, not knit
620711	6digit	Mens, boys underpants or briefs, of cotton, not knit			Mens underpants or briefs, cotton, not knit
620719	6digit	Mens, boys underpants, briefs, material nes, not knit			Mens underpants & briefs, material nes, not knit
620721	6digit	Mens, boys nightshirts or pyjamas, cotton, not knit			Mens pyjamas, cotton, not knit
620722	6digit	Mens/boys nightshirts, pyjama, manmade fibre, not kni			Mens pyjamas, manmade fibre, not knit
620729	6digit	Mens, boys nightshirt, pyjamas, material nes, not kni			Mens pyjamas, material nes, not knit
620791	6digit	Mens, boys dressing gowns, etc cotton, not knit			Mens dressing gowns, cotton, not knit
620792	6digit	Mens, boys dressing gowns etc manmade fibre, not knit			Mens dressing gowns, manmade fibre, not knit
620799	6digit	Mens, boys dressing gowns, material nes, not knit			Mens dressing gowns, material nes, not knit
620811	6digit	Womens, girls slips etc, of manmade fibres, not knit			Womens slips etc, manmade fibres, not knit
620819	6digit	Womens, girls slips etc, of material nes, not knit			Womens slips, material nes, not knit
620821	6digit	Womens, girls nightdress, pyjamas, of cotton, not kni			Womens pyjamas, cotton, not knit
620822	6digit	Women/girl nightdress, pyjama, manmade fibre, not kni			Womens pyjamas, manmade fibre, not knit
620829	6digit	Womens girls nightdress, pyjama, material nes not kni			Womens pyjamas, material nes, not knit
620891	6digit	Womens, girls panties, bathrobes etc, cotton, not kni			Womens panties & bathrobes, cotton, not knit
620892	6digit	Women/girl panties bathrobe etc manmade fibre not kni			Womens panties & bathrobes, manmade fibre, not knit
620899	6digit	Womens, girls panties, bathrobes, etc, nes not knit			Womens panties & bathrobes, material nes, not knit
620910	6digit	Babies garments, accessories of wool or hair, not kni			Babies garments, wool/hair, not knit
620920	6digit	Babies garments, accessories of cotton, not knit			Babies garments, cotton, not knit
620930	6digit	Babies garments, accessories synthetic fibre, not kni			Babies garments, synthetic fibre, not knit
620990	6digit	Babies garments, accessories of material nes, not kni			Babies garments, material nes, not knit
621010	6digit	Garments made up of textile felts and nonwoven fabric			Garments, of textile felts & nonwoven fabric
621020	6digit	Mens, boys overcoats of impregnated, etc fabric			Mens overcoats, of impregnated fabric
621030	6digit	Womens, girls overcoats, of impregnated, etc fabric			Womens overcoats, of impregnated fabric
621040	6digit	Mens, boys garments nes, made up of impregnated fabri			Mens garments nes, of impregnated fabric
621050	6digit	Womens, girls garments nes, of impregnated fabric			Womens garments nes, of impregnated fabric
621111	6digit	Mens, boys swimwear, not knit			Mens swimwear, not knit
621112	6digit	Womens, girls swimwear, not knit			Womens swimwear, not knit
621120	6digit	Ski suits, of textile material, not knit			Ski suits, textile material, not knit
621131	6digit	Mens, boys garments nes, of wool or hair, not knit			Mens garments nes, wool/hair, not knit
621132	6digit	Mens, boys garments nes, of cotton, not knit			Mens garments nes, cotton, not knit
621133	6digit	Mens, boys garments nes, of manmade fibres, not knit			Mens garments, manmade fibres, not knit
621139	6digit	Mens, boys garments nes, of material nes, not knit			Mens garments nes, material nes, not knit
621141	6digit	Womens, girls garments nes, of wool or hair, not knit			Womens garments nes, wool/hair, not knit
621142	6digit	Womens, girls garments nes, of cotton, not knit			Womens garments nes, cotton, not knit
621143	6digit	Womens, girls garments nes, manmade fibres, not knit			Womens garments, manmade fibres, not knit
621149	6digit	Womens, girls garments nes, material nes, not knit			Womens garments nes, material nes, not knit
621210	6digit	Brassieres and parts thereof			Brassieres
621220	6digit	Girdles, panty girdles and parts thereof			Girdles
621230	6digit	Corselettes and parts thereof			Corselettes
621290	6digit	Corsets, braces and parts thereof			Corsets
621310	6digit	Handkerchiefs, of silk or silk waste, not knit			Handkerchiefs, of silk, not knit
621320	6digit	Handkerchiefs, of cotton, not knit			Handkerchiefs, of cotton, not knit
621390	6digit	Handkerchiefs, of material nes, not knit			Handkerchiefs, of material nes, not knit
621410	6digit	Shawls, scarves, etc, of silk etc, not knit			Shawls, scarves, of silk, not knit
621420	6digit	Shawls, scarves, etc, of wool or hair, not knit			Shawls, scarves, of wool/hair, not knit
621430	6digit	Shawls, scarves, etc, synthetic fibres, not knit			Shawls, scarves, synthetic fibres, not knit
621440	6digit	Shawls, scarves, etc, of artificial fibres, not knit			Shawls, scarves, of artificial fibres, not knit
621490	6digit	Shawls, scarves, etc, of material nes, not knit			Shawls, scarves, of material nes, not knit
621510	6digit	Ties, bow ties and cravats, of silk, not knit			Ties, of silk, not knit
621520	6digit	Ties, bow ties and cravats, manmade fibres, not knit			Ties, manmade fibres, not knit
621590	6digit	Ties, bow ties and cravats, material nes, not knit			Ties, material nes, not knit
621600	6digit	Gloves, mittens and mitts, textile material, not knit			Gloves, textile material, not knit
621710	6digit	Clothing accessories nes, textile material, not knit			Clothing accessories, textile material, not knit
621790	6digit	Parts of garments, clothing accessories nes, not knit			Parts of garments, not knit
630110	6digit	Electric blankets of textile material			Electric blankets, of textile material
630120	6digit	Blankets (non-electric) & travelling rug, wool or hai			Blankets, wool or hair
630130	6digit	Blankets (non-electric) and travelling rugs, of cotto			Blankets, of cotton
630140	6digit	Blankets (except electric) & travel rugs, synth fibre			Blankets, synthetic fibre
630190	6digit	Blankets (except electric) & travel rugs, material ne			Blankets, material nes
630210	6digit	Bed linen, of textile knit or crochet materials			Bed linen, of textile materials, knit
630221	6digit	Bed linen, of cotton, printed, not knit			Bed linen, of cotton, printed
630222	6digit	Bed linen, of manmade fibres, printed, not knit			Bed linen, of manmade fibres, printed
630229	6digit	Bed linen, of material nes, printed, not knit			Bed linen, of material nes, printed, not knit
630231	6digit	Bed linen, of cotton, nes			Bed linen, of cotton, nes
630232	6digit	Bed linen, of manmade fibres, nes			Bed linen, of manmade fibres, nes
630239	6digit	Bed linen, of material nes, nes			Bed linen, of material nes
630240	6digit	Table linen, of textile knit or crochet materials			Table linen, of textile materials, knit
630251	6digit	Table linen, of cotton, not knit			Table linen, of cotton, not knit
630252	6digit	Table linen, of flax, not knit			Table linen, of flax
