"","code","name","level","parent_id","name_es","name_en","name_short_es","name_short_en"
627,"5305","Coconut, abaca (Manila hemp or Musa textilis Nee), ramie and other vegetable textile fibers,not elsewhere specified or included, raw or processed but not spun; tow, noils and waste of these fibers (including yarn waste and garnetted stock)","4digit",623.0,"Coco, abacá (cáñamo de Manila (Musa textilis Nee)), ramio y demás fibras textiles vegetales no expresadas ni comprendidas en otra parte, en bruto o trabajadas, pero sin hilar; estopas y desperdicios de estas fibras (incluidos los desperdicios de hilados y las hilachas).","Coconut, abaca (Manila hemp or Musa textilis Nee), ramie and other vegetable textile fibers,not elsewhere specified or included, raw or processed but not spun; tow, noils and waste of these fibers (including yarn waste and garnetted stock)","Coco y demás fibras textiles vegetales","Coconut and other vegetable textile fibers"
628,"5306","Flax yarn","4digit",623.0,"Hilados de lino.","Flax yarn","Hilados de lino","Flax yarn"
629,"5307","Yarn of jute or of other textile bast fibers of heading 5303","4digit",623.0,"Hilados de yute o demás fibras textiles del líber de la partida 53.03.","Yarn of jute or of other textile bast fibers of heading 5303","Hilados de fibras textiles del líber","Yarn of textile bast fibers"
630,"5308","Yarn of other vegetable textile fibers; paper yarn","4digit",623.0,"Hilados de las demás fibras textiles vegetales; hilados de papel.","Yarn of other vegetable textile fibers; paper yarn","Hilados de las demás fibras textiles vegetales","Yarn of other vegetable textile fibers"
631,"5309","Woven fabrics of flax","4digit",623.0,"Tejidos de lino.","Woven fabrics of flax","Tejidos de lino","Woven fabrics of flax"
632,"5311","Woven fabrics of other vegetable textile fibers; woven fabrics of paper yarn:","4digit",623.0,"Tejidos de las demás fibras textiles vegetales; tejidos de hilados de papel.","Woven fabrics of other vegetable textile fibers; woven fabrics of paper yarn:","Tejidos de las demás fibras textiles vegetales","Woven fabrics of vegetable textile fibers"
633,"54","Man-made filaments.","2digit",589.0,"Filamentos artificiales","Man-made filaments.","Filamentos artificiales","Man-made filaments"
634,"5401","Sewing thread of man-made filaments, whether or not put up for retail sale","4digit",633.0,"Hilo de coser de filamentos sintéticos o artificiales, incluso acondicionado para la venta al por menor.","Sewing thread of man-made filaments, whether or not put up for retail sale","Hilo de coser de filamentos sintéticos","Sewing thread of man-made filaments"
635,"5402","Synthetic filament yarn (other than sewing thread), not put up for retail sale, including synthetic monofilament of less than 67 decitex","4digit",633.0,"Hilados de filamentos sintéticos (excepto el hilo de coser) sin acondicionar para la venta al por menor, incluidos los monofilamentos sintéticos de título inferior a 67 decitex.","Synthetic filament yarn (other than sewing thread), not put up for retail sale, including synthetic monofilament of less than 67 decitex","Hilados de filamentos sintéticos","Synthetic filament yarn"
636,"5403","Artificial filament yarn (other than sewing thread), not put up for retail sale, including artificial monofilament of less than 67 decitex","4digit",633.0,"Hilados de filamentos artificiales (excepto el hilo de coser) sin acondicionar para la venta al por menor, incluidos los monofilamentos artificiales de título inferior a 67 decitex.","Artificial filament yarn (other than sewing thread), not put up for retail sale, including artificial monofilament of less than 67 decitex","Hilados de filamentos artificiales","Artificial filament yarn"
637,"5404","Synthetic monofilament of 67 decitex or more and of which no cross-sectional dimension exceeds 1 mm; strip and the like (for example, artificial straw) of synthetic textile materials of an apparent width not exceeding 5 mm","4digit",633.0,"Monofilamentos sintéticos de título superior o igual a 67 decitex y cuya mayor dimensión de la sección transversal sea inferior o igual a 1 mm; tiras y formas similares (por ejemplo, paja artificial) de materia textil sintética, de anchura aparente inferior o igual a 5 mm.","Synthetic monofilament of 67 decitex or more and of which no cross-sectional dimension exceeds 1 mm; strip and the like (for example, artificial straw) of synthetic textile materials of an apparent width not exceeding 5 mm","Monofilamentos sintéticos > 67 decitex y sección transversal < 1 mm","Synthetic monofilament >67 dtex, thickness < 1mm"
638,"5405","Artificial monofilament of 67 decitex or more and of which no cross-sectional dimension exceeds 1 mm; strip and the like (for example, artificial straw) of artificial textile materials of an apparent width not exceeding 5 mm:","4digit",633.0,"Monofilamentos artificiales de título superior o igual a 67 decitex y cuya mayor dimensión de la sección transversal sea inferior o igual a 1 mm; tiras y formas similares (por ejemplo, paja artificial) de materia textil artificial, de anchura aparente inferior o igual a 5 mm.","Artificial monofilament of 67 decitex or more and of which no cross-sectional dimension exceeds 1 mm; strip and the like (for example, artificial straw) of artificial textile materials of an apparent width not exceeding 5 mm:","Monofilamentos artificiales > 67 decitex y sección transversal < 1 mm","Artificial monofilament >67dtex t<1mm, strip, straws t<5mm"
639,"5406","Man-made filament yarn (other than sewing thread), put up for retail sale:","4digit",633.0,"Hilados de filamentos sintéticos o artificiales (excepto el hilo de coser), acondicionados para la venta al por menor.","Man-made filament yarn (other than sewing thread), put up for retail sale:","Hilados de filamentos sintéticos para la venta al por menor","Man-made filament yarn for retail sale"
640,"5407","Woven fabrics of synthetic filament yarn, including woven fabrics obtained from materials of heading 5404","4digit",633.0,"Tejidos de hilados de filamentos sintéticos, incluidos los tejidos fabricados con los productos de la partida 54.04.","Woven fabrics of synthetic filament yarn, including woven fabrics obtained from materials of heading 5404","Tejidos de hilados de filamentos sintéticos","Woven fabrics of synthetic filament yarn"
641,"5408","Woven fabrics of artificial filament yarn, including woven fabrics obtained from materials of heading 5405","4digit",633.0,"Tejidos de hilados de filamentos artificiales, incluidos los fabricados con productos de la partida 54.05.","Woven fabrics of artificial filament yarn, including woven fabrics obtained from materials of heading 5405","Tejidos de hilados de filamentos artificiales","Woven fabrics of artificial filament yarn"
642,"55","Man-made staple fibres.","2digit",589.0,"Fibras artificiales discontinuas","Man-made staple fibres.","Fibras artificiales discontinuas","Man-made staple fibres"
643,"5501","Synthetic filament tow","4digit",642.0,"Cables de filamentos sintéticos.","Synthetic filament tow","Cables de filamentos sintéticos","Synthetic filament tow"
644,"5502","Artificial filament tow","4digit",642.0,"Cables de filamentos artificiales.","Artificial filament tow","Cables de filamentos artificiales","Artificial filament tow"
645,"5503","Synthetic staple fibers, not carded, combed or otherwise processed for spinning","4digit",642.0,"Fibras sintéticas discontinuas, sin cardar, peinar ni transformar de otro modo para la hilatura.","Synthetic staple fibers, not carded, combed or otherwise processed for spinning","Fibras sintéticas discontinuas","Synthetic staple fibers"
646,"5504","Artificial staple fibers, not carded, combed or otherwise processed for spinning","4digit",642.0,"Fibras artificiales discontinuas, sin cardar, peinar ni transformar de otro modo para la hilatura.","Artificial staple fibers, not carded, combed or otherwise processed for spinning","Fibras artificiales discontinuas","Artificial staple fibers, not processed for spinning"
647,"5505","Waste (including noils, yarn waste and garnetted stock) of man-made fibers","4digit",642.0,"Desperdicios de fibras sintéticas o artificiales (incluidas las borras, los desperdicios de hilados y las hilachas).","Waste (including noils, yarn waste and garnetted stock) of man-made fibers","Desperdicios de fibras sintéticas","Waste of man-made fibers"
648,"5506","Synthetic staple fibers, carded, combed or otherwise processed for spinning","4digit",642.0,"Fibras sintéticas discontinuas, cardadas, peinadas o transformadas de otro modo para la hilatura.","Synthetic staple fibers, carded, combed or otherwise processed for spinning","Fibras sintéticas discontinuas, transformadas","Synthetic staple fibers, processed"
649,"5507","Artificial staple fibers, carded, combed or otherwise processed for spinning","4digit",642.0,"Fibras artificiales discontinuas, cardadas, peinadas o transformadas de otro modo para la hilatura.","Artificial staple fibers, carded, combed or otherwise processed for spinning","Fibras artificiales discontinuas, transformadas","Artificial staple fibers, processed"
650,"5508","Sewing thread of man-made staple fibers, whether or not put up for retail sale","4digit",642.0,"Hilo de coser de fibras sintéticas o artificiales, discontinuas, incluso acondicionado para la venta al por menor.","Sewing thread of man-made staple fibers, whether or not put up for retail sale","Hilo de coser de fibras sintéticas discontinuas","Sewing thread of man-made staple fibers"
651,"5509","Yarn (other than sewing thread) of synthetic staple fibers, not put up for retail sale","4digit",642.0,"Hilados de fibras sintéticas discontinuas (excepto el hilo de coser) sin acondicionar para la venta al por menor.","Yarn (other than sewing thread) of synthetic staple fibers, not put up for retail sale","Hilados de fibras sintéticas discontinuas","Yarn of synthetic staple fibers, not for retail sale"
652,"5511","Yarn (other than sewing thread) of man-made staple fibers, put up for retail sale","4digit",642.0,"Hilados de fibras sintéticas o artificiales, discontinuas (excepto el hilo de coser), acondicionados para la venta al por menor.","Yarn (other than sewing thread) of man-made staple fibers, put up for retail sale","Hilados de fibras sintéticas discontinuas acondicionados para la venta al por menor","Yarn of man-made staple fibers, for retail sale"
653,"5512","Woven fabrics of synthetic staple fibers, containing 85 percent or more by weight of synthetic staple fibers","4digit",642.0,"Tejidos de fibras sintéticas discontinuas con un contenido de fibras sintéticas discontinuas superior o igual al 85% en peso.","Woven fabrics of synthetic staple fibers, containing 85 percent or more by weight of synthetic staple fibers","Tejidos de fibras sintéticas discontinuas > 85%","Woven fabrics of > 85% synthetic staple fibers"
654,"5513","Woven fabrics of synthetic staple fibers, containing less than 85 percent by weight of such fibers, mixed mainly or solely with cotton, of a weight not exceeding 170 g/m2","4digit",642.0,"Tejidos de fibras sintéticas discontinuas con un contenido de estas fibras inferior al 85% en peso, mezcladas exclusiva o principalmente con algodón, de peso inferior o igual a 170 g/m².","Woven fabrics of synthetic staple fibers, containing less than 85 percent by weight of such fibers, mixed mainly or solely with cotton, of a weight not exceeding 170 g/m2","Tejidos de fibras sintéticas discontinuas < 85%","Woven fabrics of < 85% synthetic staple fibers"
655,"5514","Woven fabrics of synthetic staple fibers, containing less than 85 percent by weight of such fibers, mixed mainly or solely with cotton, of a weight exceeding 170 g/m2","4digit",642.0,"Tejidos de fibras sintéticas discontinuas con un contenido de estas fibras inferior al 85% en peso, mezcladas exclusiva o principalmente con algodón, de peso superior a 170 g/m².","Woven fabrics of synthetic staple fibers, containing less than 85 percent by weight of such fibers, mixed mainly or solely with cotton, of a weight exceeding 170 g/m2","Tejidos de fibras sintéticas discontinuas con un contenido de estas fibras < 85% en peso, mezcladas con algodón, de peso > 170 g/m²","Woven fabrics of < 85% synthetic staple fibers mixed mainly with cotton < 170 g/m2"
656,"5515","Other woven fabrics of synthetic staple fibers","4digit",642.0,"Los demás tejidos de fibras sintéticas discontinuas.","Other woven fabrics of synthetic staple fibers","Los demás tejidos de fibras sintéticas discontinuas","Other woven fabrics of synthetic staple fibers"
657,"5516","Woven fabrics of artificial staple fibers","4digit",642.0,"Tejidos de fibras artificiales discontinuas.","Woven fabrics of artificial staple fibers","Tejidos de fibras artificiales discontinuas","Woven fabrics of artificial staple fibers"
658,"56","Wadding, felt and nonwovens; special yarns; twine, cordage, ropes and cables and articles thereof","2digit",589.0,"Guata, fieltro y tela sin tejer; hilados especiales; cordeles, cuerdas y cordajes y sus artículos","Wadding, felt and nonwovens; special yarns; twine, cordage, ropes and cables and articles thereof","Guata, fieltro y tela sin tejer","Wadding, felt and nonwovens"
659,"5601","Wadding of textile materials and articles thereof; textile fibers, not exceeding 5 mm in length (flock), textile dust and mill neps","4digit",658.0,"Guata de materia textil y artículos de esta guata; fibras textiles de longitud inferior o igual a 5 mm (tundizno), nudos y motas de materia textil.","Wadding of textile materials and articles thereof; textile fibers, not exceeding 5 mm in length (flock), textile dust and mill neps","Guata de materia textil","Wadding of textile materials"
660,"5602","Felt, whether or not impregnated, coated, covered or laminated","4digit",658.0,"Fieltro, incluso impregnado, recubierto, revestido o estratificado.","Felt, whether or not impregnated, coated, covered or laminated","Fieltro","Felt"
661,"5603","Nonwovens, whether or not impregnated, coated, covered or laminated","4digit",658.0,"Tela sin tejer, incluso impregnada, recubierta, revestida o estratificada.","Nonwovens, whether or not impregnated, coated, covered or laminated","Tela sin tejer","Nonwoven textiles"
662,"5604","Rubber thread and cord, textile covered; textile yarn, and strip and the like of heading 5404 or 5405, impregnated, coated, covered or sheathed with rubber or plastics","4digit",658.0,"Hilos y cuerdas de caucho revestidos de textiles; hilados textiles, tiras y formas similares de las partidas 54.04 ó 54.05, impregnados, recubiertos, revestidos o enfundados con caucho o plástico.","Rubber thread and cord, textile covered; textile yarn, and strip and the like of heading 5404 or 5405, impregnated, coated, covered or sheathed with rubber or plastics","Textiles de caucho","Rubber textiles"
663,"5605","Metalized yarn, whether or not gimped, being textile yarn, or strip or the like of heading 5404 or 5405, combined with metal in the form of thread, strip or powder or covered with metal:","4digit",658.0,"Hilados metálicos e hilados metalizados, incluso entorchados, constituidos por hilados textiles, tiras o formas similares de las partidas 54.04 ó 54.05, combinados con metal en forma de hilos, tiras o polvo, o revestidos de metal.","Metalized yarn, whether or not gimped, being textile yarn, or strip or the like of heading 5404 or 5405, combined with metal in the form of thread, strip or powder or covered with metal:","Hilados metálicos","Metallised yarn"
664,"5606","Gimp yarn & strip, synthetic or artificial monofilament","4digit",658.0,"Hilados entorchados, tiras y formas similares de las partidas 54.04 ó 54.05, entorchadas (excepto los de la partida 56.05 y los hilados de crin entorchados); hilados de chenilla; hilados “de cadeneta”.","Gimp yarn & strip, synthetic or artificial monofilament","Hilados entorchados","Gimp yarn"
665,"5607","Twine, cordage, ropes and cables, whether or not plaited or braided and whether or not impregnated, coated, covered or sheathed with rubber or plastics","4digit",658.0,"Cordeles, cuerdas y cordajes, estén o no trenzados, incluso impregnados, recubiertos, revestidos o enfundados con caucho o plástico.","Twine, cordage, ropes and cables, whether or not plaited or braided and whether or not impregnated, coated, covered or sheathed with rubber or plastics","Cordeles, cuerdas y cordajes","Twine and ropes of baste fibers"
666,"5608","Knotted netting of twine, cordage or rope; made up fishing nets and other made up nets, of textile materials","4digit",658.0,"Redes de mallas anudadas, en paño o en pieza, fabricadas con cordeles, cuerdas o cordajes; redes confeccionadas para la pesca y demás redes confeccionadas, de materia textil.","Knotted netting of twine, cordage or rope; made up fishing nets and other made up nets, of textile materials","Redes","Nets"
667,"5609","Articles of yarn, strip or the like of heading 5404 or 5405, twine, cordage, rope or cables, not elsewhere specified or included:","4digit",658.0,"Artículos de hilados, tiras o formas similares de las partidas 54.04 ó 54.05, cordeles, cuerdas o cordajes, no expresados ni comprendidos en otra parte.","Articles of yarn, strip or the like of heading 5404 or 5405, twine, cordage, rope or cables, not elsewhere specified or included:","Artículos de hilados y otras formas similares","Articles of yarn, rope etc not elsewhere clasified"
668,"57","Carpets and other textile floor coverings.","2digit",589.0,"Alfombras y demás revestimientos para el suelo.","Carpets and other textile floor coverings.","Alfombras","Carpets"
669,"5701","Carpets and other textile floor coverings, knotted, whether or not made up","4digit",668.0,"Alfombras de nudo de materia textil, incluso confeccionadas.","Carpets and other textile floor coverings, knotted, whether or not made up","Alfombras de nudo de materia textil","Carpets, knotted"
670,"5702","Carpets and other textile floor coverings, woven, not tufted or flocked, whether or not made up, including Kelem, Schumacks, Karamanie and similar hand-woven rugs","4digit",668.0,"Alfombras y demás revestimientos para el suelo, de materia textil, tejidos, excepto los de mechón insertado y los flocados, aunque estén confeccionados, incluidas las alfombras llamadas “Kelim” o “Kilim”, “Schumacks” o “Soumak”, “Karamanie” y alfombras similares tejidas a mano.","Carpets and other textile floor coverings, woven, not tufted or flocked, whether or not made up, including Kelem, Schumacks, Karamanie and similar hand-woven rugs","Alfombras tejidos","Woven carpets and rugs"
671,"5703","Carpets and other textile floor coverings, tufted, whether or not made up","4digit",668.0,"Alfombras y demás revestimientos para el suelo, de materia textil, con mechón insertado, incluso confeccionados.","Carpets and other textile floor coverings, tufted, whether or not made up","Alfombras, copetudo","Carpets, tufted"
672,"5704","Carpets and other textile floor coverings, of felt, not tufted or flocked, whether or not made up","4digit",668.0,"Alfombras y demás revestimientos para el suelo, de fieltro, excepto los de mechón insertado y los flocados, incluso confeccionados.","Carpets and other textile floor coverings, of felt, not tufted or flocked, whether or not made up","Alfombras de fieltro","Carpets of felt"
673,"5705","Other carpets and other textile floor coverings, whether or not made up:","4digit",668.0,"Las demás alfombras y revestimientos para el suelo, de materia textil, incluso confeccionados.","Other carpets and other textile floor coverings, whether or not made up:","Las demás alfombras","Other carpets"
674,"58","Special woven fabrics; tufted textile fabrics; lace; tapestries; trimmings; embroidery.","2digit",589.0,"Tejidos especiales; telas textiles con pelo insertado; encajes; tapices; guarniciones; bordado","Special woven fabrics; tufted textile fabrics; lace; tapestries; trimmings; embroidery.","Tejidos especiales","Special woven fabrics"
675,"5801","Woven pile fabrics and chenille fabrics, other than fabrics of heading 5802 or 5806","4digit",674.0,"Terciopelo y felpa, excepto los de punto, y tejidos de chenilla, excepto los productos de las partidas 58.02 ó 58.06.","Woven pile fabrics and chenille fabrics, other than fabrics of heading 5802 or 5806","Terciopelo, felpa y tejidos de chenilla","Woven pile fabrics"
676,"5802","Terry toweling and similar woven terry fabrics, other than narrow fabrics of heading 5806; tufted textile fabrics, other than products of heading 5703","4digit",674.0,"Tejidos con bucles del tipo toalla, excepto los productos de la partida 58.06; superficies textiles con mechón insertado, excepto los productos de la partida 57.03.","Terry toweling and similar woven terry fabrics, other than narrow fabrics of heading 5806; tufted textile fabrics, other than products of heading 5703","Tejidos con bucles del tipo toalla","Terry cloth"
677,"5803","Gauze, other than narrow fabrics of heading 5806:","4digit",674.0,"Tejidos de gasa de vuelta, excepto los productos de la partida 58.06.","Gauze, other than narrow fabrics of heading 5806:","Gasa","Gauze"
678,"5804","Tulles and other net fabrics, not including woven, knitted or crocheted fabrics; lace in the piece, in strips or in motifs, other than fabrics of headings 6002 to 6006","4digit",674.0,"Tul, tul-bobinot y tejidos de mallas anudadas; encajes en pieza, en tiras o en aplicaciones, excepto los productos de las partidas 60.02 a 60.06.","Tulles and other net fabrics, not including woven, knitted or crocheted fabrics; lace in the piece, in strips or in motifs, other than fabrics of headings 6002 to 6006","Tul y tejidos de mallas anudadas","Tulles and other net fabrics"
679,"5805","Hand-woven tapestries of the type Gobelins, Flanders, Aubusson, Beauvais and the like, and needle-worked tapestries (for example, petit point, cross stitch), whether or not made up:","4digit",674.0,"Tapicería tejida a mano (gobelinos, Flandes, Aubusson, Beauvais y similares) y tapicería de aguja (por ejemplo: de “petit point”, de punto de cruz), incluso confeccionadas.","Hand-woven tapestries of the type Gobelins, Flanders, Aubusson, Beauvais and the like, and needle-worked tapestries (for example, petit point, cross stitch), whether or not made up:","Tapicería tejida a mano","Hand-woven tapestries"
680,"5806","Narrow woven fabrics, other than goods of heading 5807; narrow fabrics consisting of warp without weft assembled by means of an adhesive (bolducs)","4digit",674.0,"Cintas, excepto los artículos de la partida 58.07; cintas sin trama, de hilados o fibras paralelizados y aglutinados.","Narrow woven fabrics, other than goods of heading 5807; narrow fabrics consisting of warp without weft assembled by means of an adhesive (bolducs)","Cintas","Narrow woven fabrics"
681,"5807","Labels, badges and similar articles of textile materials, in the piece, in strips or cut to shape or size, not embroidered","4digit",674.0,"Etiquetas, escudos y artículos similares, de materia textil, en pieza, cintas o recortados, sin bordar.","Labels, badges and similar articles of textile materials, in the piece, in strips or cut to shape or size, not embroidered","Etiquetas, escudos y artículos similares, de materia textil","Labels, badges and similar articles of textile materials"
682,"5808","Braids in the piece; ornamental trimmings in the piece, without embroidery, other than knitted or crocheted; tassels, pompons and similar articles","4digit",674.0,"Trenzas en pieza; artículos de pasamanería y artículos ornamentales análogos, en pieza, sin bordar, excepto los de punto; bellotas, madroños, pompones, borlas y artículos similares.","Braids in the piece; ornamental trimmings in the piece, without embroidery, other than knitted or crocheted; tassels, pompons and similar articles","Trenzas en pieza","Braids in piece"
683,"5809","Woven fabrics of metal thread and woven fabrics of metalized yarn of heading 5605, of a kind used in apparel, as furnishing fabrics or for similar purposes, not elsewhere specified or included (229)","4digit",674.0,"Tejidos de hilos de metal y tejidos de hilados metálicos o de hilados textiles metalizados de la partida 56.05, de los tipos utilizados en prendas de vestir, tapicería o usos similares, no expresados ni comprendidos en otra parte.","Woven fabrics of metal thread and woven fabrics of metalized yarn of heading 5605, of a kind used in apparel, as furnishing fabrics or for similar purposes, not elsewhere specified or included (229)","Tejidos de hilos de metal","Woven fabric incorporating metal threads"
684,"5811","Quilted textile products in the piece, composed of one or more layers of textile materials assembled with padding by stitching or otherwise, other than embroidery of heading 5810:","4digit",674.0,"Productos textiles acolchados en pieza, constituidos por una o varias capas de materia textil combinadas con una materia de relleno y mantenidas mediante puntadas u otro modo de sujeción, excepto los bordados de la partida 58.10.","Quilted textile products in the piece, composed of one or more layers of textile materials assembled with padding by stitching or otherwise, other than embroidery of heading 5810:","Productos textiles acolchados en pieza","Quilted textile products"
685,"59","Impregnated, coated, covered or laminated textile fabrics; textile articles of a kind suitable for industrial use.","2digit",589.0,"Tejidos impregnados, recubiertos, revestidos o estratificados; artículos textiles de los tipos utilizados para el uso industrial.","Impregnated, coated, covered or laminated textile fabrics; textile articles of a kind suitable for industrial use.","Tejidos impregnados, recubiertos, revestidos o estratificados","Impregnated, coated, covered or laminated textile fabrics"
