"","code","name","level","parent_id","name_es","name_en","name_short_es","name_short_en"
356,"2934","Nucleic acids and their salts, whether or not chemically defined; other heterocyclic compounds","4digit",325.0,"Ácidos nucleicos y sus sales, aunque no sean de constitución química definida; los demás compuestos heterocíclicos.","Nucleic acids and their salts, whether or not chemically defined; other heterocyclic compounds","Ácidos nucleicos y sus sales","Nucleic acids and their salts"
357,"2935","Sulfonamides","4digit",325.0,"Sulfonamidas.","Sulfonamides","Sulfonamidas","Sulfonamides"
358,"2936","Provitamins and vitamins, natural or reproduced by synthesis (including natural concentrates), derivatives thereof used primarily as vitamins, and intermixtures of the foregoing, whether or not in any solvent","4digit",325.0,"Provitaminas y vitaminas, naturales o reproducidas por síntesis (incluidos los concentrados naturales) y sus derivados utilizados principalmente como vitaminas, mezclados o no entre sí o en disoluciones de cualquier clase.","Provitamins and vitamins, natural or reproduced by synthesis (including natural concentrates), derivatives thereof used primarily as vitamins, and intermixtures of the foregoing, whether or not in any solvent","Vitaminas","Vitamins"
359,"2937","Hormones, prostaglandins, thromboxanes and leukotrienes, natural or reproduced by synthesis; derivatives and structural analogues thereof, including chain modified polypeptides, used primarily as hormones","4digit",325.0,"Hormonas, prostaglandinas, tromboxanos y leucotrienos, naturales o reproducidos por síntesis; sus derivados y análogos estructurales, incluidos los polipéptidos de cadena Modificada, utilizados principalmente como hormonas.","Hormones, prostaglandins, thromboxanes and leukotrienes, natural or reproduced by synthesis; derivatives and structural analogues thereof, including chain modified polypeptides, used primarily as hormones","Hormonas","Hormones"
360,"2938","Glycosides, natural or reproduced by synthesis, and their salts, ethers, esters and other derivatives","4digit",325.0,"Heterósidos, naturales o reproducidos por síntesis, sus sales, éteres, ésteres y demás derivados.","Glycosides, natural or reproduced by synthesis, and their salts, ethers, esters and other derivatives","Heterósidos","Glycosides"
361,"2939","Vegetable alkaloids, natural or reproduced by synthesis, and their salts, ethers, esters and other derivatives","4digit",325.0,"Alcaloides vegetales, naturales o reproducidos por síntesis, sus sales, éteres, ésteres y demás derivados.","Vegetable alkaloids, natural or reproduced by synthesis, and their salts, ethers, esters and other derivatives","Alcaloides vegetales","Vegetable alkaloids"
362,"2941","Antibiotics","4digit",325.0,"Antibióticos.","Antibiotics","Antibióticos","Antibiotics"
363,"2942","Other organic compounds","4digit",325.0,"Los demás compuestos orgánicos.","Other organic compounds","Los demás compuestos orgánicos","Other organic compounds"
364,"30","Pharmaceutical products.","2digit",277.0,"Productos farmaceuticos","Pharmaceutical products.","Productos farmaceuticos","Pharmaceutical products"
365,"3001","Glands and other organs for organotherapeutic uses, dried, whether or not powdered; extracts of glands or other organs or of their secretions for organotherapeutic uses; heparin and its salts; other human or animal substances prepared for therapeutic or p","4digit",364.0,"Glándulas y demás órganos para usos opoterápicos, desecados, incluso pulverizados; extractos de glándulas o de otros órganos o de sus secreciones, para usos opoterápicos; heparina y sus sales; las demás sustancias humanas o animales preparadas para usos terapéuticos o profilácticos, no expresadas ni comprendidas en otra parte.","Glands and other organs for organotherapeutic uses, dried, whether or not powdered; extracts of glands or other organs or of their secretions for organotherapeutic uses; heparin and its salts; other human or animal substances prepared for therapeutic or p","Órganos para usos opoterapicos","Organs for therapeutic use"
366,"3002","Human blood; animal blood prepared for therapeutic, prophylactic or diagnostic uses; antisera and other blood fractions and modified immunological products, whether or not obtained by means of biotechnological processes; vaccines, toxins, cultures of micr","4digit",364.0,"Sangre humana; sangre animal preparada para usos terapéuticos, profilácticos o de diagnóstico; antisueros (sueros con anticuerpos), demás fracciones de la sangre y productos inmunológicos, incluso modificados u obtenidos por procesos biotecnológicos; vacunas, toxinas, cultivos de microorganismos (excepto las levaduras) y productos similares.","Human blood; animal blood prepared for therapeutic, prophylactic or diagnostic uses; antisera and other blood fractions and modified immunological products, whether or not obtained by means of biotechnological processes; vaccines, toxins, cultures of micr","Sangre","Blood"
367,"3003","Medicaments (excluding goods of heading 3002, 3005 or 3006) consisting of two or more constituents which have been mixed together for therapeutic or prophylactic uses, not put up in measured doses or in forms or packings for retail sale","4digit",364.0,"Medicamentos (excepto los productos de las partidas 30.02, 30.05 ó 30.06) constituidos por productos mezclados entre sí, preparados para usos terapéuticos o profilácticos, sin dosificar ni acondicionar para la venta al por menor.","Medicaments (excluding goods of heading 3002, 3005 or 3006) consisting of two or more constituents which have been mixed together for therapeutic or prophylactic uses, not put up in measured doses or in forms or packings for retail sale","Medicamentos, no envasados","Medicaments, not packaged"
368,"3004","Medicaments (excluding goods of heading 3002, 3005 or 3006) consisting of mixed or unmixed products for therapeutic or prophylactic uses, put up in measured doses (including those in the form of transdermal administration systems) or in forms or packings","4digit",364.0,"Medicamentos (excepto los productos de las partidas 30.02, 30.05 ó 30.06) constituidos por productos mezclados o sin mezclar, preparados para usos terapéuticos o profilácticos, dosificados (incluidos los administrados por vía transdérmica) o acondicionados para la venta al por menor.","Medicaments (excluding goods of heading 3002, 3005 or 3006) consisting of mixed or unmixed products for therapeutic or prophylactic uses, put up in measured doses (including those in the form of transdermal administration systems) or in forms or packings","Medicamentos, envasados","Medicaments, packaged"
369,"3005","Wadding, gauze, bandages and similar articles (for example, dressings, adhesive plasters, poultices), impregnated or coated with pharmaceutical substances or put up in forms or packings for retail sale for medical, surgical, dental or veterinary purposes","4digit",364.0,"Guatas, gasas, vendas y artículos análogos (por ejemplo: apósitos, esparadrapos, sinapismos), impregnados o recubiertos de sustancias farmacéuticas o acondicionados para la venta al por menor con fines médicos, quirúrgicos, odontológicos o veterinarios.","Wadding, gauze, bandages and similar articles (for example, dressings, adhesive plasters, poultices), impregnated or coated with pharmaceutical substances or put up in forms or packings for retail sale for medical, surgical, dental or veterinary purposes","Guatas, gasas, y vendas","Wadding, gauze and bandages"
370,"3006","Pharmaceutical goods specified in note 4 to this chapter","4digit",364.0,"Preparaciones y artículos farmacéuticos a que se refiere la Nota 4 de este Capítulo.","Pharmaceutical goods specified in note 4 to this chapter","Artículos farmacéuticos","Pharmaceutical goods"
371,"31","Fertilisers.","2digit",277.0,"Abonos","Fertilisers.","Abonos","Fertilisers"
372,"3101","Animal or vegetable fertilizers, whether or not mixed together or chemically treated; fertilizers produced by the mixing or chemical treatment of animal or vegetable products","4digit",371.0,"Abonos de origen animal o vegetal, incluso mezclados entre sí o tratados químicamente; abonos procedentes de la mezcla o del tratamiento químico de productos de origen animal o vegetal.","Animal or vegetable fertilizers, whether or not mixed together or chemically treated; fertilizers produced by the mixing or chemical treatment of animal or vegetable products","Abonos de origen animal o vegetal","Animal or vegetable fertilizers"
373,"3102","Mineral or chemical fertilizers, nitrogenous","4digit",371.0,"Abonos minerales o químicos nitrogenados.","Mineral or chemical fertilizers, nitrogenous","Abonos, nitrogenados","Nitrogenous fertilizers"
374,"3103","Mineral or chemical fertilizers, phosphatic","4digit",371.0,"Abonos minerales o químicos fosfatados.","Mineral or chemical fertilizers, phosphatic","Abonos, fosfatados","Phosphatic fertilizers"
375,"3104","Mineral or chemical fertilizers, potassic","4digit",371.0,"Abonos minerales o químicos potásicos.","Mineral or chemical fertilizers, potassic","Abonos, potásicos","Potassic fertilizers"
376,"3105","Mineral or chemical fertilizers containing two or three of the fertilizing elements nitrogen, phosphorus and potassium; other fertilizers; goods of this chapter in tablets or similar forms or in packages of a gross weight not exceeding 10 kg","4digit",371.0,"Abonos minerales o químicos, con dos o tres de los elementos fertilizantes: nitrógeno, fósforo y potasio; los demás abonos; productos de este Capítulo en tabletas o formas similares o en envases de un peso bruto inferior o igual a 10 kg.","Mineral or chemical fertilizers containing two or three of the fertilizing elements nitrogen, phosphorus and potassium; other fertilizers; goods of this chapter in tablets or similar forms or in packages of a gross weight not exceeding 10 kg","Abonos, mixtos","Mixed fertilizers"
377,"32","Tanning or dyeing extracts; tannins and their derivatives; dyes, pigments and other colouring matter; paints and varnishes; putty and other mastics; inks.","2digit",277.0,"Extractos curtientes o tintóreos; taninos y sus derivados; tintes, pigmentos y demás materias colorantes; pinturas y barnices; tintes y otros mastiques; tintas","Tanning or dyeing extracts; tannins and their derivatives; dyes, pigments and other colouring matter; paints and varnishes; putty and other mastics; inks.","Tintes, pinturas, tintas, etc. ","Dyes, paints, inks, etc. "
378,"3201","Tanning extracts of vegetable origin; tannins and their salts, ethers, esters and other derivatives","4digit",377.0,"Extractos curtientes de origen vegetal; taninos y sus sales, éteres, ésteres y demás derivados.","Tanning extracts of vegetable origin; tannins and their salts, ethers, esters and other derivatives","Extractos curtientes de origen vegetal","Tanning extracts of vegetable origen"
379,"3202","Synthetic organic tanning substances; inorganic tanning substances; tanning preparations, whether or not containing natural tanning substances; enzymatic preparations for pre-tanning","4digit",377.0,"Productos curtientes orgánicos sintéticos; productos curtientes inorgánicos; preparaciones curtientes, incluso con productos curtientes naturales; preparaciones enzimáticas para precurtido.","Synthetic organic tanning substances; inorganic tanning substances; tanning preparations, whether or not containing natural tanning substances; enzymatic preparations for pre-tanning","Productos curtientes orgánicos sintéticos","Synthetic organic tanning substances"
380,"3203","Coloring matter of vegetable or animal origin (including dyeing extracts but excluding animal black), whether or not chemically defined; preparations as specified in note 3 to this chapter based on coloring matter of vegetable or animal origin","4digit",377.0,"Materias colorantes de origen vegetal o animal (incluidos los extractos tintóreos, excepto los negros de origen animal), aunque sean de constitución química definida; preparaciones a que se refiere la Nota 3 de este Capítulo a base de materias colorantes de origen vegetal o animal.","Coloring matter of vegetable or animal origin (including dyeing extracts but excluding animal black), whether or not chemically defined; preparations as specified in note 3 to this chapter based on coloring matter of vegetable or animal origin","Materias colorantes de origen animal o vegetal","Coloring matter of animal or vegetable origin"
381,"3204","Synthetic organic coloring matter, whether or not chemically defined; preparations as specified in note 3 to this chapter based on synthetic organic coloring matter; synthetic organic products of a kind used as fluorescent brightening agents or as luminop","4digit",377.0,"Materias colorantes orgánicas sintéticas, aunque sean de constitución química definida; preparaciones a que se refiere la Nota 3 de este Capítulo a base de materias colorantes orgánicas sintéticas; productos orgánicos sintéticos de los tipos utilizados para el avivado fluorescente o como luminóforos, aunque sean de constitución química definida.","Synthetic organic coloring matter, whether or not chemically defined; preparations as specified in note 3 to this chapter based on synthetic organic coloring matter; synthetic organic products of a kind used as fluorescent brightening agents or as luminop","Materias colorantes orgánicas sintéticas","Synthetic organic coloring matter"
382,"3205","Color lakes; preparations as specified in note 3 to this chapter based on color lakes","4digit",377.0,"Lacas colorantes; preparaciones a que se refiere la Nota 3 de este Capítulo a base de lacas colorantes.","Color lakes; preparations as specified in note 3 to this chapter based on color lakes","Lacas colorantes","Color lakes"
383,"3206","Other coloring matter; preparations as specified in note 3 to this chapter, other than those of heading 3203, 3204 or 3205; inorganic products of a kind used as luminophores, whether or not chemically defined","4digit",377.0,"Las demás materias colorantes; preparaciones a que se refiere la Nota 3 de este Capítulo, excepto las de las partidas 32.03, 32.04 ó 32.05; productos inorgánicos de los tipos utilizados como luminóforos, aunque sean de constitución química definida.","Other coloring matter; preparations as specified in note 3 to this chapter, other than those of heading 3203, 3204 or 3205; inorganic products of a kind used as luminophores, whether or not chemically defined","Las demás materias colorantes","Other coloring matter"
384,"3207","Prepared pigments, prepared opacifiers and prepared colors, vitrifiable enamels and glazes, engobes (slips), liquid lustres and similar preparations, of a kind used in the ceramic, enamelling or glass industry; glass frit and other glass, in the form of p","4digit",377.0,"Pigmentos, opacificantes y colores preparados, composiciones vitrificables, engobes, abrillantadores (lustres) líquidos y preparaciones similares, de los tipos utilizados en cerámica, esmaltado o en la industria del vidrio; frita de vidrio y demás vidrios, en polvo, gránulos, copos o escamillas.","Prepared pigments, prepared opacifiers and prepared colors, vitrifiable enamels and glazes, engobes (slips), liquid lustres and similar preparations, of a kind used in the ceramic, enamelling or glass industry; glass frit and other glass, in the form of p","Pigmentos preparados","Prepared pigments"
385,"3208","Paints and varnishes (including enamels and lacquers) based on synthetic polymers or chemically modified natural polymers, dispersed or dissolved in a nonaqueous medium; solutions as defined in note 4 to this chapter","4digit",377.0,"Pinturas y barnices a base de polímeros sintéticos o naturales modificados, dispersos o disueltos en un medio no acuoso; disoluciones definidas en la Nota 4 de este Capítulo.","Paints and varnishes (including enamels and lacquers) based on synthetic polymers or chemically modified natural polymers, dispersed or dissolved in a nonaqueous medium; solutions as defined in note 4 to this chapter","Pinturas y barnices, non-acuosos","Paints and varnishes, nonaqueous"
386,"3209","Paints and varnishes (including enamels and lacquers) based on synthetic polymers or chemically modified natural polymers, dispersed or dissolved in an aqueous medium","4digit",377.0,"Pinturas y barnices a base de polímeros sintéticos o naturales modificados, dispersos o disueltos en un medio acuoso.","Paints and varnishes (including enamels and lacquers) based on synthetic polymers or chemically modified natural polymers, dispersed or dissolved in an aqueous medium","Pinturas y barnices, acuosos","Paints and varnishes, aqueous"
387,"3211","Prepared driers","4digit",377.0,"Secativos preparados.","Prepared driers","Secativos preparados","Prepared driers"
388,"3212","Pigments (including metallic powders and flakes) dispersed in nonaqueous media, in liquid or paste form, of a kind used in the manufacture of paints (including enamels); stamping foils; dyes and other coloring matter put up in forms or packings for retail","4digit",377.0,"Pigmentos (incluidos el polvo y escamillas metálicos) dispersos en medios no acuosos, líquidos o en pasta, de los tipos utilizados para la fabricación de pinturas; hojas para el marcado a fuego; tintes y demás materias colorantes presentados en formas o en envases para la venta al por menor.","Pigments (including metallic powders and flakes) dispersed in nonaqueous media, in liquid or paste form, of a kind used in the manufacture of paints (including enamels); stamping foils; dyes and other coloring matter put up in forms or packings for retail","Pigmentos, no acuosos","Pigments, nonaqueous"
389,"3213","Artists', students' or signboard painters' colors, modifying tints, amusement colors and the like, in tablets, tubes, jars, bottles, pans or in similar forms or packings","4digit",377.0,"Colores para la pintura artística, la enseñanza, la pintura de carteles, para matizar o para entretenimiento y colores similares, en pastillas, tubos, botes, frascos o en formas o envases similares.","Artists', students' or signboard painters' colors, modifying tints, amusement colors and the like, in tablets, tubes, jars, bottles, pans or in similar forms or packings","Colores para la pintura artística","Artists' colors"
390,"3214","Glaziers' putty, grafting putty, resin cements, caulking compounds and other mastics; painters' fillings; nonrefractory surfacing preparations for facades, indoor walls, floors, ceilings or the like","4digit",377.0,"Masilla, cementos de resina y demás mástiques; plastes (enduidos) utilizados en pintura; plastes (enduidos) no refractarios de los tipos utilizados en albañilería.","Glaziers' putty, grafting putty, resin cements, caulking compounds and other mastics; painters' fillings; nonrefractory surfacing preparations for facades, indoor walls, floors, ceilings or the like","Masilla","Glaziers' putty"
391,"3215","Printing ink, writing or drawing ink and other inks, whether or not concentrated or solid","4digit",377.0,"Tintas de imprimir, tintas de escribir o de dibujar y demás tintas, incluso concentradas o sólidas.","Printing ink, writing or drawing ink and other inks, whether or not concentrated or solid","Tinta","Ink"
392,"33","Essential oils and resinoids; perfumery, cosmetic or toilet preparations.","2digit",277.0,"Aceites esenciales y resinoides; preparaciones de perfumería, de tocador o de cosmética","Essential oils and resinoids; perfumery, cosmetic or toilet preparations.","Aceites esenciales","Essential oils"
393,"3301","Essential oils (terpeneless or not), including concretes and absolutes; resinoids; extracted oleoresins; concentrates of essential oils in fats, in fixed oils, in waxes or the like, obtained by enfleurage or maceration; terpenic by-products of the deterpe","4digit",392.0,"Aceites esenciales (desterpenados o no), incluidos los “concretos” o “absolutos”; resinoides; oleorresinas de extracción; disoluciones concentradas de aceites esenciales en grasas, aceites fijos, ceras o materias análogas, obtenidas por enflorado o maceración; subproductos terpénicos residuales de la desterpenación de los aceites esenciales; destilados acuosos aromáticos y disoluciones acuosas de aceites esenciales.","Essential oils (terpeneless or not), including concretes and absolutes; resinoids; extracted oleoresins; concentrates of essential oils in fats, in fixed oils, in waxes or the like, obtained by enfleurage or maceration; terpenic by-products of the deterpe","Aceites esenciales","Essential oils"
394,"3302","Mixtures of odoriferous substances and mixtures (including alcoholic solutions) with a basis of one or more of these substances, of a kind used as raw materials in industry; other preparations based on odoriferous substances, of a kind used for the manufa","4digit",392.0,"Mezclas de sustancias odoríferas y mezclas (incluidas las disoluciones alcohólicas) a base de una o varias de estas sustancias, de los tipos utilizados como materias básicas para la industria; las demás preparaciones a base de sustancias odoríferas, de los tipos utilizados para la elaboración de bebidas.","Mixtures of odoriferous substances and mixtures (including alcoholic solutions) with a basis of one or more of these substances, of a kind used as raw materials in industry; other preparations based on odoriferous substances, of a kind used for the manufa","Mezclas de sustancias odoríferas","Mixtures of odoriferous subtances"
395,"3303","Perfumes and toilet waters","4digit",392.0,"Perfumes y aguas de tocador.","Perfumes and toilet waters","Perfumes y aguas de tocador","Perfumes"
396,"3304","Beauty or make-up preparations and preparations for the care of the skin (other than medicaments), including sunscreen or sun tan preparations; manicure or pedicure preparations","4digit",392.0,"Preparaciones de belleza, maquillaje y para el cuidado de la piel, excepto los medicamentos, incluidas las preparaciones antisolares y las bronceadoras; preparaciones para manicuras o pedicuros.","Beauty or make-up preparations and preparations for the care of the skin (other than medicaments), including sunscreen or sun tan preparations; manicure or pedicure preparations","Preparaciones de maquillaje","Beauty or make-up preparations"
397,"3305","Preparations for use on the hair","4digit",392.0,"Preparaciones capilares.","Preparations for use on the hair","Preparaciones capilares","Hair products"
398,"3306","Preparations for oral or dental hygiene, including denture fixative pastes and powders; yarn used to clean between the teeth (dental floss), in individual retail packages","4digit",392.0,"Preparaciones para higiene bucal o dental, incluidos los polvos y cremas para la adherencia de las dentaduras; hilo utilizado para limpieza de los espacios interdentales (hilo dental), en envases individuales para la venta al por menor.","Preparations for oral or dental hygiene, including denture fixative pastes and powders; yarn used to clean between the teeth (dental floss), in individual retail packages","Productos de higiene dental","Dental hygiene products"
399,"3307","Pre-shave, shaving or after-shave preparations, personal deodorants, bath preparations, depilatories and other perfumery, cosmetic or toilet preparations, not elsewhere specified or included; prepared room deodorizers, whether or not perfumed","4digit",392.0,"Preparaciones para afeitar o para antes o después del afeitado, desodorantes corporales, preparaciones para el baño, depilatorios y demás preparaciones de perfumería, de tocador o de cosmética, no expresadas ni comprendidas en otra parte; preparaciones desodorantes de locales, incluso sin perfumar, aunque tengan propiedades desinfectantes.","Pre-shave, shaving or after-shave preparations, personal deodorants, bath preparations, depilatories and other perfumery, cosmetic or toilet preparations, not elsewhere specified or included; prepared room deodorizers, whether or not perfumed","Productos para afeitar","Toiletries"
400,"34","Soap, organic surface-active agents, washing preparations, lubricating preparations, artificial waxes, prepared waxes, polishing or scouring preparations, candles and similar articles, modelling pastes, ""dental waxes"" and dental preparations with a basis of plaster.","2digit",277.0,"Jabón, agentes de superficie orgánicos, preparaciones para lavar, preparaciones lubricantes, ceras artificiales, ceras preparadas, pulido o fregar, velas y artículos similares, pastas para modelar, ""ceras para odontología"" y preparaciones para odontología a base de yeso.","Soap, organic surface-active agents, washing preparations, lubricating preparations, artificial waxes, prepared waxes, polishing or scouring preparations, candles and similar articles, modelling pastes, ""dental waxes"" and dental preparations with a basis of plaster.","",""
