Code	hs4_name	hs4_name_en	community
7505	Nickel bars, rods, profiles and wire	Nickel bars, rods, profiles and wire	616
7506	Nickel plates, sheets, strip and foil	Nickel plates, sheets, strip and foil	616
7507	Nickel tubes, pipes and tube or pipe fittings (for example, couplings, elbows,sleeves)	Nickel tubes, pipes and tube or pipe fittings	616
7508	Other articles of nickel	Other articles of nickel	616
7601	Unwrought aluminum	Unwrought aluminum	616
7602	Waste or scrap, aluminium	Waste or scrap, aluminium	616
7603	Aluminum powders and flakes	Aluminum powders and flakes	616
7604	Aluminum bars, rods and profiles	Aluminum bars, rods and profiles	616
7605	Aluminum wire	Aluminum wire	616
7606	Aluminum plates, sheets and strip, of a thickness exceeding 0.2 mm	Aluminum plates, sheets and strip > 0.2 mm	616
7607	Aluminum foil (whether or not printed, or backed with paper, paperboard, plastics or similar backing materials) of a thickness(excluding any backing) not exceeding 0.2 mm	Aluminum foil < 0.2 mm	616
7608	Aluminum tubes and pipes	Aluminum tubes and pipes	616
7609	Aluminum tube or pipe fittings (for example, couplings, elbows, sleeves)	Aluminum tube or pipe fittings	616
7610	Aluminum structures (excluding prefabricated buildings of heading 9406) and parts of structures (for example, bridges and bridge-sections, towers, lattice masts, roofs, roofing frameworks, doors and windows and their frames and thresholds for doors, balus	Aluminum structures (bridges, towers etc)	616
7611	Aluminium reservoirs,vats, tanks, etc, volume >300l	Aluminium reservoirs, vats, tanks, etc	616
7612	Aluminum casks, drums, cans, boxes and similar containers (including rigid or collapsible tubular containers), for any material (other than compressed or liquefied gas), of a capacity not exceeding300 liters, whether or not lined or heat insulated, but no	Aluminum cans and similar containers	616
7613	Aluminum containers for compressed or liquefied gas	Aluminum containers for compressed or liquefied gas	616
7614	Stranded wire, cables, plaited bands and the like,including slings and similar articles, of aluminum, not electrically insulated	Stranded wire, cables of aluminum slings and similar articles	616
7615	Table, kitchen or other household articles and parts thereof, of aluminum; pot scourers and scouring or polishing pads, gloves and the like, of aluminum; sanitary ware and parts thereof, of aluminum	Table, kitchen or other household articles of aluminum	616
7616	Other articles of aluminum	Other articles of aluminum	616
7801	Lead refined unwrought	Lead refined unwrought	616
7802	Lead waste or scrap	Lead waste or scrap	616
7803	Lead bars, rods, profiles and wire	Lead bars, rods, profiles and wire	616
7804	Lead foil of a thickness <2mm	Lead foil of a thickness <2mm	616
7805	Lead tubes, pipes and fittings	Lead tubes, pipes and fittings	616
7806	Other articles of lead	Other articles of lead	616
7901	Unwrought zinc	Unwrought zinc	616
7902	Zinc waste and scrap	Zinc waste and scrap	616
7903	Zinc dust, powders and flakes	Zinc dust, powders and flakes	616
7904	Zinc bars, rods, profiles and wire	Zinc bars, rods, profiles and wire	616
7905	Zinc plates, sheets, strip and foil	Zinc plates, sheets, strip and foil	616
7906	Zinc tubes, pipes and tube or pipe fittings	Zinc tubes, pipes and tube or pipe fittings	616
7907	Other articles of zinc:	Other articles of zinc	616
8001	Unwrought tin	Unwrought tin	616
8002	Tin waste and scrap	Tin waste and scrap	616
8003	Tin bars, rods, profiles and wire	Tin bars, rods, profiles and wire	616
8004	Tin plates, sheets and strips, thickness > 0.2 mm	Tin plates, sheets and strips, thickness > 0.2 mm	616
8005	Tin foil (thickness < 0.2 mm)	Tin foil (thickness < 0.2 mm)	616
8006	Tin pipes or tubes and pipe fittings	Tin pipes or tubes and pipe fittings	616
8007	Other articles of tin:	Other articles of tin	616
8101	Tungsten (wolfram) and articles thereof, including waste and scrap	Tungsten (wolfram)	616
8102	Molybdenum and articles thereof, including waste and scrap	Molybdenum	616
8103	Tantalum and articles thereof,including waste and scrap	Tantalum	616
8104	Magnesium and articles thereof, including waste and scrap	Magnesium	616
8105	Cobalt mattes and other intermediate products of cobalt metallurgy; cobalt and articles thereof,including waste and scrap	Cobalt	616
8106	Bismuth and articles thereof, including waste and scrap	Bismuth	616
8107	Cadmium and articles thereof, including waste and scrap	Cadmium	616
8108	Titanium and articles thereof, including waste and scrap	Titanium	616
8109	Zirconium and articles thereof, including waste and scrap	Zirconium	616
8110	Antimony and articles thereof,including waste and scrap	Antimony	616
8111	Manganese and articles thereof, including waste and scrap:	Manganese	616
8112	Beryllium, chromium,germanium, vanadium, gallium, hafnium, indium, niobium (columbium), rhenium and thallium,and articles of these metals, including waste and scrap	Other metals	616
8113	Cermets and articles thereof, including waste and scrap	Cermets	616
8201	Hand tools of the following kinds and base metal parts thereof spades, shovels, mattocks, picks, hoes, forks and rakes; axes,bill hooks and similar hewing tools; secateurs and pruners of any kind; scythes, sickles, hay knives, hedge shears, timber wedges 	Hand tools base metal parts thereof spades, shovels, picks, forks and rakes; axes and similar hewing tools; pruners of any kind; scythes, sickles, hedge shears	616
8202	Handsaws, and metal parts thereof; blades for saws of all kinds (including slitting, slotting or toothless saw blades), and base metal parts thereof	Handsaws, and metal parts thereof	616
8203	Files, rasps, pliers (including cutting pliers), pincers, tweezers, metal cutting shears, pipe cutters, bolt cutters, perforating punches and similar hand tools, and base metal parts thereof	Files, rasps, pliers, pincers, tweezers, metal cutting shears, pipe cutter, and base metal parts thereof	616
8204	Hand-operated spanners and wrenches (including torque meter wrenches but not including tap wrenches); socket wrenches, with or without handles,drives or extensions; base metal parts thereof	Hand-operated spanners and wrenches	616
8205	Hand tools (including glass cutters) not elsewhere specified or included; blowtorches and similar self-contained torches; vises, clamps and the like, other than accessories for and parts of machine tools; anvils; portable forges; hand- or pedal-operated g	Hand tools (including glass cutters) not elsewhere specified	616
8206	Tools of two or more of headings 8202 to 8205, put up in sets for retail sale	Tools of two or more types of hand tools, for retail sale	616
8207	Interchangeable tools for hand tools, whether or not power-operated, or for machine-tools (for example, for pressing, stamping, punching, tapping, threading, drilling,boring, broaching, milling, turning or screw driving), including dies for drawing or ext	Interchangeable tools for hand tools	616
8208	Knives and cutting blades, for machines or for mechanical appliances,and base metal parts thereof	Knives and cutting blades for machines	616
8209	Of other cermets	Tool plates/tips/etc, sintered metal carbide & cermet	616
8210	Hand-operated mechanical appliances, weighing 10 kgor less, used in the preparation, conditioning or serving of food or drink, and base metal parts thereof	Hand-operated appliances, food preparation, <10kg	616
8211	Knives with cutting blades,serrated or not (including pruning knives), other than knives of heading 8208, and blades and other base metal parts thereof	Sets of different knives, cutlery sets	616
8212	Razors and razor blades (including razor blade blanks in strips), and base metal parts thereof	Razors including safety razors, open blade razors	616
8213	Scissors, tailors' shears and similar shears, and blades and other base metal parts thereof:	Scissors, tailors/similar shears, blades thereof	616
8214	Other articles of cutlery (for example, hair clippers, butchers' or kitchen cleavers, chopping or mincing knives, paper knives);manicure or pedicure sets and instruments (including nail files); base metal parts thereof	Other cutlery	616
8215	Spoons, forks, ladles,skimmers, cake-servers, fish-knives, butter-knives, sugar tongs and similar kitchen or tableware;and base metal parts thereof	Cutlery sets plated with precious metal	616
8301	Padlocks and locks (key,combination or electrically operated), of base metal; clasps and frames with clasps, incorporating locks, of base metal; keys and parts of any of the foregoing articles, of base metal	Padlocks of base metal	616
8302	Base metal mountings, fittings and similar articles suitable for furniture, doors,staircases, windows, blinds, coachwork, saddlery, trunks, chests, caskets or the like; base metal hat racks, hat-pegs, brackets and similar fixtures; castors with mountings 	Base metal mountings, fittings and similar articles suitable for furniture; base metal hat racks; castors with mountings 	616
8303	Armored or reinforced safes, strong-boxes and doors and safe deposit lockers for strong-rooms, cash or deed boxes and the like, and parts thereof, of base metal	Armored or reinforced safes, strong-boxes	616
8304	Desk-top filing or card-index cabinets, paper trays, paper rests, pen trays, office-stamp stands and similar office or desk equipment and parts thereof, of base metal, other than office furniture of heading 9403	Desk-top filing or card-index cabinets and parts thereof	616
8305	Fittings for looseleaf binders or files, letter clips, letter corners, paper clips,indexing tags and similar office articles, and parts thereof, of base metal; staples in strips (for example, for offices, upholstery, packaging), of base metal	Miscellaneous office goods	616
8306	Bells, gongs and the like, nonelectric, of base metal; statuettes and other ornaments, of base metal; photograph, picture or similar frames, of base metal; mirrors of base metal; and base metal parts thereof	Bells and gongs	616
8307	Flexible tubing of base metal,with or without fittings	Flexible tubing of base metal with or without fittings	616
8308	Clasps, frames with clasps, buckles, buckle clasps, hooks, eyes, eyelets and the like and parts thereof, of base metal, of a kind used for clothing, footwear, awnings, handbags,travel goods or other made up articles; tubular or bifurcated rivets of base m	Clasps, frames with clasps, buckles, hooks, and the like of base metal used for clothing, footwear, awnings, handbags	616
8309	Stoppers, caps and lids (including crown corks, screw caps and pouring stoppers),capsules for bottles, threaded bungs, bung covers, seals and other packing accessories, and parts thereof, of base metal	Stoppers, caps and lids	616
8310	Sign plates, name plates, address plates and similar plates, numbers, letters and other symbols, and parts thereof, of base metal, excluding those of heading 9405	Sign plates, name plates, address plates and similar plates	616
8311	Wire, rods, tubes, plates, electrodes and similar products of base metal or of metal carbides,coated or cored with flux material, of a kind used for soldering, brazing, welding or deposition of metal or of metal carbides; wire and rods, of agglomerated ba	Wire, rods, tubes, plates, electrodes and similar products of base metal	616
8401	Nuclear reactors; fuel elements (cartridges), non-irradiated, for nuclear reactors; machinery and apparatus for isotopic separation; parts thereof	Nuclear reactors and related equipment	706
8402	Steam or other vapor generating boilers (other than central heating hot water boilers capable also of producing low pressure steam); super-heated water boilers; parts thereof	Steam or other vapor generating boilers	706
8403	Central heating boilers (other than those of heading 8402) and parts thereof	Central heating boilers	706
8404	Auxiliary plant for use with boilers of heading 8402 or 8403 (for example, economizers, super-heaters, soot removers, gas recoverers); condensers for steam or other vapor power units; parts thereof	Auxiliary plant for use with boilers; condensers for steam or other vapor power units	706
8405	Producer gas or water gas generators, with or without their purifiers; acetylene gas generators and similar water process gas generators, with or without their purifiers; parts thereof	Producer gas or water gas generators	706
8406	Steam turbines and other vapor turbines, and parts thereof	Steam turbines and other vapor turbines	706
8407	Spark-ignition reciprocating or rotary internal combustion piston engines	Spark-ignition reciprocating or rotary internal combustion piston engines	706
8408	Compression-ignition internal combustion piston engines (diesel or semi-diesel engines)	Compression-ignition internal combustion piston engines	706
8409	Parts suitable for use solely or principally with the engines of heading 8407 or 8408	Parts suitable for use with spark-ignition engines	706
8410	Hydraulic turbines, water wheels and regulators therefor; parts thereof	Hydraulic turbines, water wheels	706
8411	Turbojets, turbo propellers and other gas turbines, and parts thereof	Turbojets, turbo propellers and other gas turbines	706
8412	Other engines and motors, and parts thereof	Other engines and motors	706
8413	Pumps for liquids, whether or not fitted with a measuring device; liquid elevators; part thereof	Pumps for liquids	706
8414	Air or vacuum pumps, air or other gas compressors and fans; ventilating or recycling hoods incorporating a fan, whether or not fitted with filters; parts thereof	Air or vacuum pumps; ventilating or recycling hoods	706
8415	Air conditioning machines, comprising a motor-driven fan and elements for changing the temperature and humidity, including those machines in which the humidity cannot be separately regulated; parts thereof	Air conditioners	706
8416	Furnace burners for liquid fuel, for pulverized solid fuel or for gas; mechanical stokers, including their mechanical grates, mechanical ash dischargers and similar appliances; parts thereof	Furnace burners for liquid fuel	706
8417	Industrial or laboratory furnaces and ovens, including incinerators, nonelectric, and parts thereof	Industrial or laboratory furnaces and ovens, including incinerators	706
8418	Refrigerators, freezers and other refrigerating or freezing equipment, electric or other; heat pumps, other than the air conditioning machines of heading 8415; parts thereof	Refrigerators, freezers	706
8419	Machinery, plant or laboratory equipment, whether or not electrically heated (excluding furnaces, ovens and other equipment of heading 8514), for the treatment of materials by a process involving a change of temperature such as heating, cooking, roasting,	Machinery, plant or laboratory equipment involving a change of temperature such as heating, cooking, roasting	706
8420	Calendering or other rolling machines, other than for metals or glass, and cylinders therefor; parts thereof	Calendering or other rolling machines	706
8421	Centrifuges, including centrifugal dryers; filtering or purifying machinery and apparatus, for liquids or gases; parts thereof	Centrifuges	706
8422	Dishwashing machines; machinery for cleaning or drying bottles or other containers; machinery for filling, closing, sealing or labeling bottles, cans, boxes, bags or other containers; machinery for capsuling bottles, jars, tubes and similar containers; ot	Dishwashing machines; machinery for cleaning or drying containers; machinery for filling, closing, sealing or labeling containers	706
8423	Weighing machinery (excluding balances of a sensitivity of 5 cg or better), including weight-operated counting or checking machines; weighing machine weights of all kinds; parts of weighing machinery	Weighing machinery	706
8424	Mechanical appliances (whether or not hand operated) for projecting, dispersing or spraying liquids or powders; fire extinguishers, whether or not charged; spray guns and similar appliances; steam or sand blasting machines and similar jet projecting machi	Mechanical appliances for dispersing liquids or powders; fire extinguishers; spray guns; steam or sand blasting machines	706
8425	Pulley tackle and hoists other than skip hoists; winches and capstans; jacks	Pulley tackle and hoists; winches and capstans; jacks	706
8426	Ships' derricks; cranes, including cable cranes; mobile lifting frames, straddle carriers and works trucks fitted with a crane	Ships' derricks; cranes	706
8427	Fork-lift trucks; other works trucks fitted with lifting or handling equipment	Fork-lift trucks	706
8428	Other lifting, handling, loading or unloading machinery (for example, elevators, escalators, conveyors, teleferics)	Other lifting, handling, loading or unloading machinery (for example, elevators, escalators, conveyors, teleferics)	706
8429	Self-propelled bulldozers, angledozers, graders, levelers, scrapers, mechanical shovels, excavators, shovel loaders, tamping machines and road rollers	Self-propelled bulldozers, excavators and road rollers	706
8430	Other moving, grading, leveling, scraping, excavating, tamping, compacting, extracting or boring machinery, for earth, minerals or ores; pile-drivers and pile-extractors; snowplows and snowblowers	Other moving, excavating, extracting or boring machinery for earth, minerals or ores; pile-drivers; snowplows and snowblowers	706
8431	Parts suitable for use solely or principally with the machinery of headings 8425 to 8430	Parts for use with hoists and excavation machinery	706
8432	Agricultural, horticultural or forestry machinery for soil preparation or cultivation; lawn or sports ground rollers; parts thereof	Agricultural, forestry machinery for soil preparation	706
8433	Harvesting or threshing machinery, including straw or fodder balers; grass or hay mowers; machines for cleaning, sorting or grading eggs, fruit or other agricultural produce, other than machinery of heading 8437; parts thereof	Harvesting or agricultural machinery	706
8434	Milking machines and dairy machinery, and parts thereof	Milking and dairy machines	706
8435	Presses, crushers and similar machinery, used in the manufacture of wine, cider, fruit juices or similar beverages; parts thereof	Presses, crushers used in the manufacture of wine, cider, fruit juices	706
8436	Other agricultural, horticultural, forestry, poultry-keeping or bee-keeping machinery, including germination plant fitted with mechanical or thermal equipment; poultry incubators and brooders; parts thereof	Other agricultural, horticultural, forestry equipment; poultry incubators and brooders	706
8437	Machines for cleaning, sorting or grading seed, grain or dried leguminous vegetables, and parts thereof; machinery used in the milling industry or for the working of cereals or dried leguminous vegetables, other than farm type machinery; parts thereof	Machines for cleaning, sorting or grading seed; machinery used in the milling industry or for the working of cereals or dried leguminous vegetables	706
8438	Machinery, not specified or included elsewhere in this chapter, for the industrial preparation or manufacture of food or drink, other than machinery for the extraction or preparation of animal or fixed vegetable fats or oils; parts thereof	Machinery, not specified for the industrial preparation or manufacture of food or drink	706
8439	Machinery for making pulp of fibrous cellulosic material or for making or finishing paper or paperboard (other than the machinery of heading 8419); parts thereof	Machinery for making pulp of cellulosic material or for making paper	706
8440	Bookbinding machinery, including book-sewing machines, and parts thereof	Bookbinding machinery	706
8441	Other machinery for making up paper pulp, paper or paperboard, including cutting machines of all kinds, and parts thereof	Other machinery for making paper pulp, paper or paperboard	706
8442	Machinery, apparatus and equipment (other than the machine tools of headings 8456 to 8465), for preparing or making plates, cylinders or other printing components; plates, cylinders and other printing components; plates, cylinders and lithographic stones,	Machinery for making printing components	706
8443	Printing machinery used for printing by means of plates, cylinders and other printing components of heading 8442; other printers, copying machines and facsimile machines, whether or not combined; parts and accessories thereof	Printers and copying machines	706
8444	Machines to extrude, draw, cut manmade textile fibres	Machines to extrude, cut manmade textile fibres	706
8445	Machines for preparing textile fibers; spinning, doubling or twisting machines and other machinery for producing textile yarns; textile reeling or winding (including weft winding) machines and machines for preparing textile yarns for use on the machines o	Machines for preparing textile fibers	706
8446	Weaving machines (looms)	Looms	706
8447	Knitting machines, stitch-bonding machines and machines for making gimped yarn, tulle, lace, embroidery, trimmings, braid or net and machines for tufting	Knitting machines	706
8448	Auxiliary machinery for use with machines of heading 8444, 8445, 8446 or 8447 (for example, dobbies, Jacquards, automatic stop motions and shuttle changing mechanisms); parts and accessories suitable for use solely or principally with the machines of this	Auxiliary machinery for use with knitting and textile machines	706
8449	Machinery for the manufacture or finishing of felt or nonwovens in the piece or in shapes, including machinery for making felt hats; blocks for making hats; parts thereof:	Machinery to manufacture or finish felt or nonwovens	706
8450	Household- or laundry-type washing machines, including machines which both wash and dry; parts thereof	laundry-type washing machines	706
8451	Machinery (other than machines of heading 8450) for washing, cleaning, wringing, drying, ironing, pressing (including fusing presses), bleaching, dyeing, dressing, finishing, coating or impregnating textile yarns, fabrics or made up textile articles and m	Machinery for washing, cleaning or drying fabrics	706
8452	Sewing machines, other than book-sewing machines of heading 8440; furniture, bases and covers specially designed for sewing machines; sewing machine needles; parts thereof	Sewing machines	706
8453	Machinery for preparing, tanning or working hides, skins or leather or for making or repairing footwear or other articles of hides, skins or leather, other than sewing machines; parts thereof	Machinery for preparing, tanning or working hides, skins or leather	706
8454	Converters, ladles, ingot molds and casting machines, of a kind used in metallurgy or in metal foundries, and parts thereof	Converters, ladles and casting machines used in metallurgy	706
8455	Metal-rolling mills and rolls therefor; parts thereof	Metal-rolling mills	706
8456	Machine tools for working any material by removal of material, by laser or other light or photon beam, ultrasonic, electro-discharge, electro-chemical, electron-beam, ionic-beam or plasma arc processes	Machines for the removal of material by laser or other optic means	706
8457	Machining centers, unit construction machines (single station) and multistation transfer machines, for working metal	Machining centers for working metal	706
8458	Lathes (including turning centers) for removing metal	Lathes for removing metal	706
8459	Machine tools (including way-type unit head machines) for drilling, boring, milling, threading or tapping by removing metal, other than lathes (including turning centers) of heading 8458	Machine tools for drilling, boring or milling by removing metal	706
8460	Machine tools for deburring, sharpening, grinding, honing, lapping, polishing or otherwise finishing metal or cermets by means of grinding stones, abrasives or polishing products, other than gear cutting, gear grinding or gear finishing machines of headin	Machine tools for finishing metal or cermets	706
8461	Machine tools for planing, shaping, slotting, broaching, gear cutting, gear grinding or gear finishing, sawing, cutting-off and other machine tools working by removing metal or cermets, not elsewhere specified or included	Machine tools for planing, shaping, slotting, gear cutting, or sawing	706
8462	Machine tools (including presses) for working metal by forging, hammering or die-stamping; machine tools (including presses) for working metal by bending, folding, straightening, flattening, shearing, punching or notching; presses for working metal or met	Machine tools for working metal by forging; machine tools for working metal by bending, folding, straightening  or flattening	706
8463	Other machine tools for working metal or cermets, without removing material	Other machine tools for working metal or cermets, without removal	706
8464	Machine tools for working stone, ceramics, concrete, asbestos-cement or like mineral materials or for cold working glass	Machine tools for working stone	706
8465	Machine tools (including machines for nailing, stapling, glueing or otherwise assembling) for working wood, cork, bone, hard rubber, hard plastics or similar hard materials	Machine tools for working wood	706
8466	Parts and accessories suitable for use solely or principally with the machines of headings 8456 to 8465, including work or tool holders, self-opening dieheads, dividing heads and other special attachments for machine tools; tool holders for any type of to	Parts and accessories for metal working machines	706
8467	Tools for working in the hand, pneumatic, hydraulic or with self-contained electric or nonelectric motor, and parts thereof	Tools for hand working, pneumatic, hydraulic motors	706
8468	Machinery and apparatus for soldering, brazing or welding, whether or not capable of cutting, other than those of heading 8515; gas-operated surface tempering machines and appliances; parts thereof	Machinery and apparatus for soldering, brazing or welding, whether or not capable of cutting	706
